Season,Episode,Speaker,To,Line,Location
1,1,Jeremy,Jeremy,"This is fucking wicked. I am almost definitely a musical genius. Maybe a tattoo on my chest, but of my face. Yeah, double me! Feel it!",Jez's Room
1,1,Mark,Mark,"She's on there, she's on there. Got to get the same bus home. Don't go! Almost there. Yes, I am the lord of the bus, said he! Where is she? Knickers! She's not on here.",Outside
1,1,Sophie,Mark,Hey Mark!,Bus
1,1,Mark,Sophie,Sophie!,Bus
1,1,Sophie,Mark,We must stop meeting like this.,Bus
1,1,Mark,Sophie,I was running. Were you running?,Bus
1,1,Sophie,Mark,I was right behind you. I shouted but,Bus
1,1,Mark,Sophie,"Of course, stupid music. Why don't you?",Bus
1,1,Sophie,Mark,So what did you make of Jeff's memo?,Bus
1,1,Mark,Mark,"Oh no, shit! She's... I should say. No, too late. Already it's too late. Maybe if we hit a bump I can slip it out, or keep schtum, ride it out. Gonna need to waggle eventually, keep the circulation going",Bus
1,1,Sophie,Mark,"Oh God there's something, Mark, have you? Your hand?!",Bus
1,1,Mark,Sophie,"Oh, I was going to say, but I just, sorry.",Bus
1,1,Sophie,Mark,"No, no. It's fine.",Bus
1,1,Mark,Mark,"Of course, she's giving you the book-off. Women don't want your hand under their bottoms, Mark. That's been established. That's a given. ""She sat on it officer, it was an accident."" ""Of course it was, now get in with the nonces.""",Bus
1,1,Mark,Mark,What a disaster,Outside
1,1,Boys,Mark,"Oi mate, can I have some of your Coke?",Outside
1,1,Mark,Mark,"They're going to trap me, and their brothers will hack me to",Outside
1,1,Boys,Mark,"I said, can I have a bit of your",Outside
1,1,Mark,Boys,"Here, look, you can",Outside
1,1,Boys,Mark,"Hey look, he's a paedo!",Outside
1,1,Boys,Mark,Paedo! You fucking paedo!,Outside
1,1,Mark,Mark,You're not a paedo. You're definitely not a paedo.,Outside
1,1,Boys,Mark,Paedo! Go home man!,Outside
1,1,Mark,Mark,"Those kids have no idea whatsoever of what went on at Stalingrad. Although I can in no way compare my struggle of reading it with that of the Red Army, it has been a very big read.",Living Room
1,1,TV,Mark,I'm basically hoping to meet someone who's exactly like myself.,Living Room
1,1,Mark,Mark,Pfftt. That's exactly the opposite of what I'm looking for.,Living Room
1,1,Jeremy,Mark,Hey man.,Living Room
1,1,Mark,Jeremy,Hey man.,Living Room
1,1,Jeremy,Mark,"I'm telling you, now I know whatshisname felt when he finished the Mona Lisa - knackered. So how was your day?",Living Room
1,1,Mark,Jeremy,Shit.,Living Room
1,1,Jeremy,Mark,"Well, Toni came round to drop this off.",Living Room
1,1,Mark,Jeremy,"Oh! A party? Did you, you know, make your move?",Living Room
1,1,Jeremy,Mark,"No, she was going to Starbucks to read a book. It's one of her things. Besides, the move, it's not a whole Sophie uptight situation. We're just gradually sliding into a... a fuck buddy scenario.",Living Room
1,1,Mark,Jeremy,Fuck buddy?,Living Room
1,1,Jeremy,Mark,"Yeah, a buddy, you can fuck. I mean we're both so relaxed about the whole sex thing. Last time I was around there I watched a porno. Four in the afternoon - just me and her watching a porno. I mean, that's me. I'm not ready for the kind of thing you're after. The whole... someone to go to Waitrose with.",Living Room
1,1,Mark,Jeremy,Yeah I suppose.,Living Room
1,1,Mark,Mark,I don't want to go to Waitrose. I want a fuck buddy.,Living Room
1,1,Jeremy,Jeremy,I wish I was her fuck buddy next door. We could do it through the wall.,Living Room
1,1,Jeremy,Mark,How thick is wall?,Living Room
1,1,Mark,Jeremy,"Depends. So, which Starbucks does she go to?",Living Room
1,1,Mark,Mark,"Come on, come on. Piss off. I want to go to the shop. Need a poo, got to have loo paper. I should be able to just walk out of my own front door. What's wrong with me? Would be great if a car just ploughed into the lot of them. Twisted, broken bones.",Apollo House
1,1,Toni,Mark,"Jesus, Mark! Are you OK?",Apollo House
1,1,Mark,Toni,"Hi Toni, I'm fine. I was just checking the letterbox for... sometimes they get stuck in there and the next thing you know, your phone's cut off.",Apollo House
1,1,Toni,Mark,"Right. God, you know they haven't got any Alpen at that stupid corner shop.",Apollo House
1,1,Mark,Toni,No?,Apollo House
1,1,Toni,Mark,"I asked him. I said ""Have you got any Alpen?"" He said ""No."" I said ""Well, are you going to be ordering any in?"" and he said he didn't know!",Apollo House
1,1,Mark,Toni,"Oh right, that is a bit crap.",Apollo House
1,1,Toni,Mark,It's ridiculous! What kind of a shop doesn't have Alpen?!,Apollo House
1,1,Mark,Toni,I don't know.,Apollo House
1,1,Mark,Mark,Go on.,Apollo House
1,1,Mark,Toni,I've got Alpen!,Apollo House
1,1,Toni,Mark,Yeah?,Apollo House
1,1,Mark,Toni,"Yeah, I mean... you could, have some.",Apollo House
1,1,Mark,Mark,What are you doing? What about the poo?,Apollo House
1,1,Mark,Mark,If I can just hold it in... I think it's retreating.,Kitchen
1,1,Mark,Toni,"So, here we are then. Bowl o' Alpen.",Kitchen
1,1,Toni,Mark,"It always makes me think of skiing holidays. We always used to go skiing on holiday. Me, my mum, my sister.",Kitchen
1,1,Mark,Toni,Wicked. I've got a sister. She's a lawyer actually.,Kitchen
1,1,Mark,Mark,Don't boast!,Kitchen
1,1,Mark,Toni,What does your sister do?,Kitchen
1,1,Toni,Mark,Not much. She's got leukaemia.,Kitchen
1,1,Mark,Mark,That's what you get for trying to flirt.,Kitchen
1,1,Mark,Toni,"That's terrible, I'm so sorry. I suppose, I mean at least it's not cancer.",Kitchen
1,1,Toni,Mark,It's a form of cancer.,Kitchen
1,1,Mark,Toni,"Shit, that's terrible. My gran died of cancer. Although hopefully your sister won't... obviously. Listen, let's talk about something else. Something fun. Do you like Blackadder? I got the Blackadder set for Christmas.",Kitchen
1,1,Toni,Mark,"I never really, I mean…",Kitchen
1,1,Mark,Toni,"No, no, sure, forget it. Terrible idea. I know something funny.",Kitchen
1,1,Mark,Toni,And he's been working on it for about a month!,Jez's Room
1,1,Mark,Toni,"Wait, this is the best bit.",Jez's Room
1,1,Jeremy,Jeremy,"This Grammy goes out to my homeboys in Compton, the Japanese people who mean so much to me. Hey, Mark's playing my track. Ah, he just can't get enough of that shit.",Flat
1,1,Mark,Jeremy,Jez!,Jez's Room
1,1,Jeremy,Mark,What's going on?,Jez's Room
1,1,Jeremy,Toni,Toni?,Jez's Room
1,1,Mark,Mark,"Great idea Mark. Humiliate your best mate just to. I mean why didn't we just play Othello? Oh I'd love to bang her. Just buckle down, do your time like Leslie Grantham.",Kitchen
1,1,Mark,Jeremy,"Hey Jez, you're up.",Kitchen
1,1,Jeremy,Mark,Yes that's right. I'm up.,Kitchen
1,1,Mark,Jeremy,"I'm making chicken tikka. Plus, I've bought us lots of great stuff: Dune on DVD, Bakewell slices, gin and Sara Lee. Plus, I was thinking, you know that thirty quid you owe me? Let's call it quits, yeah? I mean not quits, but you know. I'm just really, really, really, really sorry Jeremy. Cos it was only a balls up. I ballsed up, and now we're fine. This'll be ready in a minute and we can eat it in front of Hitler's Henchmen.",Kitchen
1,1,Mark,Mark,Maybe he doesn't mind. Maybe nobody minds about things as much as me.,Kitchen
1,1,Jeremy,Mark,Yeah,Kitchen
1,1,Mark,Jeremy,And listen. You know Kerry? Cancer Kerry?,Kitchen
1,1,Jeremy,Mark,Yeah,Kitchen
1,1,Mark,Jeremy,I need to find out for a friend the name of that Chinese doctor she was raving about. Can you remember?,Kitchen
1,1,Jeremy,Mark,Sure. It was Dr Ying Fu Yip... Wang Shong Pang... Fang Wang Dang Dong Ning Po Ku.,Kitchen
1,1,Mark,Jeremy,"Oh right. I see, I get it. You were lampooning me. It was a simple lampoon.",Kitchen
1,1,Super Hans,Jeremy,Hey Jez. What's up man?,Pub
1,1,Jeremy,Super Hans,Super Hans!,Pub
1,1,Super Hans,Others,"Pint of Guinness please, no logo on the foam.",Pub
1,1,Jeremy,Super Hans,No logo on the foam?,Pub
1,1,Super Hans,Jeremy,"You don't buy into all that one, do ya? What the old ""Ooh, I've got a clover in me foam. I'm so important."" No, what you're doing there is you're drinking an advert. Ain't ya? Eh? Shithead. Thank you. So, you got our track?",Pub
1,1,Jeremy,Super Hans,"No, I've been thinking, I'm not sure. I think maybe it's shit.",Pub
1,1,Super Hans,Jeremy,"Woah! Hold it cowboy, rewind, what's shit? The track's shit? Jez, the track's the shit.",Pub
1,1,Jeremy,Super Hans,It's just I found Mark laughing at it.,Pub
1,1,Super Hans,Jeremy,"What, so Mr, fucking, Ocean Colour Pants don't get it. Well quelle fucking surprise.",Pub
1,1,Jeremy,Super Hans,"Plus, he was doing it in front of Toni.",Pub
1,1,Super Hans,Jeremy,"Mate, you gotta get some rewengay. He broke omertà.",Pub
1,1,Jeremy,Super Hans,You think?,Pub
1,1,Super Hans,Jeremy,"Listen, the whole industry's run by suits like your mate.",Pub
1,1,Jeremy,Super Hans,Do you think that's why we haven't got a deal yet?,Pub
1,1,Super Hans,Jeremy,"Of course it is. They're all a bunch of Marks, ain't they? Sitting behind on their big marble desks, ties done up to eleven, clicking their fingers to the fucking Lighthouse Family, getting their dicks sucked by a big Alsatian dog.",Pub
1,1,Jeremy,Super Hans,Yeah?,Pub
1,1,Super Hans,Jeremy,"They're all perverts mate. All in with each other. It's not who you know, it's who you blow.",Pub
1,1,Jeremy,Super Hans,Right.,Pub
1,1,Mark,Mark,Why shouldn't I go for Toni? So she scares me. You can have good relationship with someone that scares you. Look at me and dad.,Outside
1,1,Mark,Mark,"Oh shit. Relax, relax, it's OK, you're not a paedo. You're just a normal human being walking past some simple children.",Outside
1,1,Mark,Boys,Hi there.,Outside
1,1,Boys,Mark,"Hey look, it's clean shirt!",Outside
1,1,Mark,Mark,Clean shirt? What does that mean? Isn't that good?,Outside
1,1,Boys,Mark,How do you get that shirt so clean mate?,Outside
1,1,Mark,Mark,You can handle it. Use the power of reason.,Outside
1,1,Mark,Boys,"Look, I know it must be difficult being a kid, not a lot of schemes, but you know, I'm not the borough. I wish I was but.",Outside
1,1,Boys,Mark,Fuck off clean shirt!,Outside
1,1,Mark,Boys,I'm just a man. Can't we just. Hey! No! Ow! Don't kick my bum! Stop it!,Outside
1,1,Mark,Mark,"Me and Toni, Toni and me. When his kooky charm starts to cloy I'll be right there. Fuck buddy number two. Yeah right, wait for the crumbs to fall while my nuts slowly shrivel. Actually I hope they do shrivel, they're getting disturbingly…",Mark's Room
1,1,Jeremy,Mark,What's the matter? I thought you liked pork.,Mark's Room
1,1,Mark,Jeremy,But how did? What does it mean?,Mark's Room
1,1,Jeremy,Mark,It means omertà. It means rewengay.,Mark's Room
1,1,Mark,Jeremy,"Look, I'm sorry, OK? I'm sorry I humiliated you in front of Toni.",Mark's Room
1,1,Jeremy,Mark,"Don't think I can't see you Mark, trying to get a slice of my action because Sophie the office girl won't put out.",Mark's Room
1,1,Mark,Jeremy,"Oh right, the gloves are off are they? Well, perhaps it's best you do know what I think of your music.",Mark's Room
1,1,Jeremy,Mark,"Well let's have some more truth shall we? Yeah, yeah? Cause the truth is, you're a posh spaz!",Mark's Room
1,1,Mark,Jeremy,"Oh really, well I'd love to know in what way I am a posh spaz.",Mark's Room
1,1,Jeremy,Mark,In the way you're always doing posh spazzy things like tidying up and ironing your socks.,Mark's Room
1,1,Mark,Jeremy,I do not iron my socks!,Mark's Room
1,1,Jeremy,Mark,"Socks, shirts, whatever!",Mark's Room
1,1,Mark,Mark,"I'm going to the party and I'll get her in the end. I have the power of the brain, the most erotic muscle. The longbow beats the crossbow my idiotic friend.",Kitchen
1,1,Mark,Jeremy,"Hey! Look, just lay off. That's my bit of lager!",Kitchen
1,1,Jeremy,Mark,"Oh, I get it. Are you going to do me in?",Kitchen
1,1,Mark,Jeremy,Don't be ridiculous.,Kitchen
1,1,Jeremy,Mark,Are you going to punch me Mark? Is that it? Is that what's going to happen?,Kitchen
1,1,Mark,Jeremy,"You just... you... you're lucky I don't... you're just very, very lucky.",Kitchen
1,1,Jeremy,Mark,"You're an animal, Corrigan. You have to keep your tie done up to eleven otherwise all this grey, ugly, office envy sludge will just spill out and drown you! And you've got weird nuts!",Kitchen
1,1,Mark,Jeremy,What? How did you?,Kitchen
1,1,Jeremy,Mark,"If you're going to watch the TV in your dressing gown, you might want to put some pants on.",Kitchen
1,1,Mark,Jeremy,So I'm glad we cleared the air.,Apollo House
1,1,Jeremy,Mark,Me too.,Apollo House
1,1,Mark,Jeremy,"I feel better, much better. Like a weight has been lifted.",Apollo House
1,1,Jeremy,Mark,Me too. That's exactly how I feel.,Apollo House
1,1,Toni,Jeremy,"Hey, hey, hey! It's the guys, come on in.",Apollo House
1,1,Jeremy,Toni,"So, Toni's friends. Who, what, why, where?",Toni's Flat
1,1,Toni,Jeremy,"Well that's the fun. I don't know anyone, these are our neighbours.",Toni's Flat
1,1,Mark,Toni,Neighbours?,Toni's Flat
1,1,Toni,Mark,"Why? Did you think I was going to invite my friends? I'll tell you, you find out who your real friends are when you set fire to Hampton Court Maze because you can't take any more of your husband's shit.",Toni's Flat
1,1,Mark,Toni,"Yeah, well its great to know your neighbours, I mean not just from a home security point of view but also…",Toni's Flat
1,1,Toni,Mark,"Right, exactly. So, drinks?",Toni's Flat
1,1,Jeremy,Toni,Wicked.,Toni's Flat
1,1,Jeremy,Jeremy,"If I laugh at everything she says, I'm bound to at least get a suck job.",Toni's Flat
1,1,Mark,Mark,"Maybe I should forget it, leave her to him. Concentrate on the long game. Work on a six pack by Christmas then make, Why should I? We really had something going when we were laughing at Jeremy! Oh too late, they're bonding.",Toni's Flat
1,1,Toni,Jeremy,What's so funny? It's only a fridge magnet.,Toni's Flat
1,1,Jeremy,Toni,I know but it looks just like a fried egg.,Toni's Flat
1,1,Mark,Mark,"Ha ha, twot.",Toni's Flat
1,1,Paula,Jeremy,"Yeah, but if I pull out now, that's the deposit gone.",Toni's Flat
1,1,Jeremy,Paula,"Right, nightmare.",Toni's Flat
1,1,Paula,Jeremy,On the other hand...,Toni's Flat
1,1,Jeremy,Jeremy,"Jesus, how did I get trapped with her? She's definitely the most boring person here. I mean they look great, they're probably talking about how they're going to make a real life porn movie with a proper story and everything. I could do the music.",Toni's Flat
1,1,Jeremy,Paula,So where do you live in the building?,Toni's Flat
1,1,Paula,Jeremy,"Oh I don't live here, I'm Toni's sister.",Toni's Flat
1,1,Jeremy,Paula,"Oh, OK, and what do you do?",Toni's Flat
1,1,Paula,Jeremy,I work in the music business.,Toni's Flat
1,1,Jeremy,Paula,You do? Well that's amazing! That's just really amazing!,Toni's Flat
1,1,Toni,Others,"Everyone writes down someone famous, we swap, put them on our foreheads and you work out who we are by asking questions. It's really really funny because you... anyway lets just play.",Toni's Flat
1,1,Jeremy,Jeremy,"Heh-heh, yeah this is it. Paula's gonna love this. Very Iggy.",Toni's Flat
1,1,Toni,Jeremy,"No, no, no Jez, when you're finished just drop your Rizla in the bowl.",Toni's Flat
1,1,Jeremy,Toni,"Oh well, could I do mine again then?",Toni's Flat
1,1,Mark,Jeremy,"We're not playing for points, mate.",Toni's Flat
1,1,Barry,Jeremy,"Come on, just drop it in old chap.",Toni's Flat
1,1,Toni,Mark,I give up.,Toni's Flat
1,1,Mark,Toni,"No! Don't! Go on, this one's mine!",Toni's Flat
1,1,Toni,Mark,Tim Henman?,Toni's Flat
1,1,Mark,Toni,"Yeah, how did you know?",Toni's Flat
1,1,Toni,Jeremy,"Hey Jeremy, have you worked out your...?",Toni's Flat
1,1,Jeremy,Toni,"Don't even go there, it is literally impossible. Turns out I was just someone's secretary!",Toni's Flat
1,1,Mark,Jeremy,"The Home Secretary, Jeremy. You're the Home Secretary.",Toni's Flat
1,1,Jeremy,Mark,"Yeah, right whatever. We're just popping next door.",Toni's Flat
1,1,Mark,Jeremy,You're going next door?,Toni's Flat
1,1,Mark,Mark,The coast is clear. The coast is clear!,Toni's Flat
1,1,Jeremy,Mark,"That's right, yeah. I'm taking Paula back to listen to my work. She seems like someone who'd appreciate a good track when she heard it.",Toni's Flat
1,1,Toni,Paula,"Cool, don't do anything I wouldn't do sis! Which leaves a hell of a lot of leeway!",Toni's Flat
1,1,Mark,Mark,I am in here. Sis? Sister! Shit!,Toni's Flat
1,1,Mark,Jeremy,Excuse me. Jez? Can I have a word?,Toni's Flat
1,1,Jeremy,Mark,"Yes, that's right, I'm going. The coast is clear. I don't expect you'll get very far but by all means have a pop at the champ.",Toni's Flat
1,1,Mark,Jeremy,"I though I better tell you, Paula, she's... she has cancer.",Toni's Flat
1,1,Jeremy,Mark,What? Are you serious?,Toni's Flat
1,1,Mark,Jeremy,I just thought I'd better mention it. You don't wanna drop a clanger.,Toni's Flat
1,1,Jeremy,Mark,"No, right.",Toni's Flat
1,1,Others,Jeremy,Is it Jamie Oliver?,Toni's Flat
1,1,Jeremy,Others,"Look, you're a cockmuncher, OK?",Toni's Flat
1,1,Jeremy,Jeremy,"Of course, you can't catch cancer. I mean, I'd have heard. Someone would've said.",Jez's Room
1,1,Paula,Jeremy,"Yeah OK, I think I've heard enough. Yeah, it's OK.",Jez's Room
1,1,Jeremy,Paula,Do you really think so?,Jez's Room
1,1,Jeremy,Jeremy,What kind? Blood? Bone? Knee? Face?,Jez's Room
1,1,Paula,Jeremy,"Yeah, I mean I like it.",Jez's Room
1,1,Jeremy,Paula,Great! I mean... that's great!,Jez's Room
1,1,Paula,Jeremy,"Listen, I'm guessing you didn't invite me round to your room just to listen to some tape. Right?",Jez's Room
1,1,Jeremy,Jeremy,"Shit. Of course, it's who you blow.",Jez's Room
1,1,Jeremy,Paula,"No, no, sure. I know the rules. Yeah. Let's get it on, baby.",Jez's Room
1,1,Toni,Mark,"Barry, that guy is one serious power tripper. He was all over my Rizla game!",Toni's Flat
1,1,Mark,Mark,"OK Mark, you asked for it, now you got it. She's looking for a fuck buddy, gotta change gears. Sauce things up.",Toni's Flat
1,1,Toni,Mark,"He just so ""Yah, take the A304"" I mean ""Yes, we can see your hairy chest, and no, we're not impressed.""",Toni's Flat
1,1,Mark,Toni,"Yeah so Jeremy tells me you two watched a porno together. You know, I'd be into…",Toni's Flat
1,1,Toni,Mark,That wasn't a porno. That was The English Patient.,Toni's Flat
1,1,Mark,Mark,"Ha! What an idiotic boob. He's out, I'm in. Now, what's my shtick? Yeah.",Toni's Flat
1,1,Mark,Toni,"You know, the Red Army shot sixteen thousand of their own men at Stalingrad.",Toni's Flat
1,1,Toni,Mark,OK.,Toni's Flat
1,1,Mark,Toni,"And of course, the majority of the Wehrmacht had no winter clothing. ",Toni's Flat
1,1,Mark,Mark,I'm the tank commander now Barry.,Toni's Flat
1,1,Toni,Mark,"Well I know how they feel. You know, you buy classic but classic keeps changing.",Toni's Flat
1,1,Mark,Toni,"See, by the winter of '42, the whole city was surrounded by the massed 6th army. It was pressing and pressing. The Russians couldn't hold on much longer. Many wanted to submit...",Toni's Flat
1,1,Toni,Mark,"Mark, you know I just don't bang anyone, yeah. I'm not some kind of next-door fuck jar.",Toni's Flat
1,1,Mark,Toni,"No, no, of course not, what I mean is that the German supply lines were stretched, Zhukov countered and the siege was broken. And that's the story of Stalingrad.",Toni's Flat
1,1,Jeremy,Jeremy,"You're a sunshine coach, bringing a last smile to…",Jez's Room
1,1,Jeremy,Paula,"Urgh, if we've got to do this, do you mind keeping the hat on? It's just... sorry.",Jez's Room
1,1,Paula,Jeremy,"We don't have to do anything, Jeremy.",Jez's Room
1,1,Jeremy,Paula,No?,Jez's Room
1,1,Paula,Jeremy,No.,Jez's Room
1,1,Jeremy,Paula,"I don't mind. I'd just rather not. We could take Polaroids of me, you know, all excited and you could take them away or something. I am very keen to sort you out, so to speak.",Jez's Room
1,1,Mark,Mark,"That was embarrassing. Not a fuck jar. Don't dwell, no need to dwell. Think charming, considerate.",Toni's Flat
1,1,Mark,Toni,"So your sister, she looks great considering...",Toni's Flat
1,1,Toni,Mark,Considering what? Considering she doesn't have any dress sense?,Toni's Flat
1,1,Mark,Toni,"No, no, you know, the whole thing. The leukaemia.",Toni's Flat
1,1,Toni,Mark,"Oh no that's not Paula. Paula's my half-sister. No, Paula's doing fine, apart from her idea of a birthday present is a bunch of CD singles. And yes, I do know you get them for free.",Toni's Flat
1,1,Barry,Toni,"Toni, we're dry. I was thinking someone should run to the offy before it shuts.",Toni's Flat
1,1,Mark,Mark,The second front. I can win on the second front.,Toni's Flat
1,1,Mark,Mark,"This is so perfect. I'm gonna be the knight on horseback with an armful of booze and enough nachos to feed the Mexican army. Oh shit. Shit. Fuck off! Why don't you fuck the fuck off? Just run the gauntlet, the little bastards will... It's gonna shut as well.",Outside
1,1,Mark,Others,"Uh, excuse me, mate? Sorry to bother you, this is a bit embarrassing really but you couldn't possibly buy me a couple bottles of wine, Pinot Grigio maybe?",Outside
1,1,Boys,Mark,"Oi! Look, it's that paedo! Haha paedo!",Outside
1,1,Jeremy,Paula,"But on the song, do you really like it?",Jez's Room
1,1,Paula,Jeremy,Yeah. I mean it's hard to get that excited about.,Jez's Room
1,1,Jeremy,Paula,"Yeah, I guess you're not in the right frame of mind to... ",Jez's Room
1,1,Jeremy,Jeremy,"Don't go on about it, Jesus.",Jez's Room
1,1,Paula,Jeremy,I mean are you going to do any more work on it?,Jez's Room
1,1,Jeremy,Jeremy,How much time has she got?,Jez's Room
1,1,Jeremy,Paula,"Maybe. I mean, how long are you planning to stay in your job?",Jez's Room
1,1,Paula,Jeremy,"You know, as long as I last.",Jez's Room
1,1,Jeremy,Paula,"Right. Look, should you be doing that?",Jez's Room
1,1,Paula,Jeremy,"Probably not, but you know, fuck it.",Jez's Room
1,1,Jeremy,Paula,"Jesus. You know, I do think you're brave. I just think you're very, very brave.",Jez's Room
1,1,Paula,Jeremy,"I make my decisions, I stick by them. Everybody said you couldn't market acid jazz to the over 30s and I was like ""Fuck that shit!""",Jez's Room
1,1,Jeremy,Paula,"Listen to you, you beautiful crazy thing. I meant... the cancer.",Jez's Room
1,1,Paula,Jeremy,I'm sorry? Which cancer?,Jez's Room
1,1,Jeremy,Paula,The bloody cancer eating you away!,Jez's Room
1,1,Paula,Jeremy,"OK, would you like it if I did have cancer?",Jez's Room
1,1,Mark,Mark,I bet Zhukov would've got some booze. Oh!,Toni's Flat
1,1,Barry,Mark,"Oh, you're back. I think it's winding down a bit now actually, mate.",Toni's Flat
1,1,Mark,Mark,Bastard.,Toni's Flat
1,1,Jeremy,Mark,Oh yeah! Very funny! I suppose you think cancer is this huge enormous practical joke!,Toni's Flat
1,1,Mark,Jeremy,"What? Oh Jeremy, I'm so sorry. I thought...",Toni's Flat
1,1,Jeremy,Mark,"No, no you're quite the guy. Certainly not the kind of sicko to ruin someone's music career by suggesting that certain other people have cancer! What joke is next? Hey Jez, your mum's dead! Ba-boom! Bloody hilarious!",Toni's Flat
1,1,Toni,Jeremy,What's going on?,Toni's Flat
1,1,Mark,Toni,I accidentally told him Paula had cancer.,Toni's Flat
1,1,Toni,Jeremy,"Jeremy, Mark got it wrong. He thought Paula was ill, she's not. It was a mistake.",Toni's Flat
1,1,Jeremy,Toni,I'm sure if Kerry was here she'd be rolling round the floor except she couldn't cause she's head to toe in acupuncture needles.,Toni's Flat
1,1,Mark,Jeremy,"Hey! Listen mate, I made a mistake. It was you who wouldn't give the name of the doctor for Toni's sister.",Toni's Flat
1,1,Paula,Mark,He wouldn't give the name for Sal?,Toni's Flat
1,1,Jeremy,Paula,What's the big deal? So I didn't give him the number for Dr Tang. She's got leukaemia. Sticking a few needles in her face at fifty quid a pop is not going to fix that.,Toni's Flat
1,1,Barry,Mark,"OK, I think it's time for you boys to fuck off now, hmm?",Toni's Flat
1,1,Mark,Sophie,"Yeah, well really really nice to catch up, Soph. See you tomorrow?",Bus
1,1,Sophie,Mark,Tomorrow.,Bus
1,1,Mark,Sophie,Great,Bus
1,1,Mark,Mark,"Yes, that's the way. Sophie's the one. Toni's Russia - vast, mysterious, unconquerable. Sophie's Poland - manageable, won't put up too much of a fight. Shit. Oh shit. OK. You want some, do you? Do you want a taste of my steel?",Outside
1,2,Mark,Mark,"I wonder what kind of socks Sophie wears. Do women wear socks? Well, yes, sometimes is the answer to that. Socks before or after trousers, but never socks before pants, that's the rule. Makes a man look scary, like a chicken.",Mark's Room
1,2,Mark,Mark,He just does not give one solitary shit.,Mark's Room
1,2,Jeremy,Jeremy,"Yeah, take that, big Suze. Your toilet-seat regime is over. Ah, freedom.",Bathroom
1,2,Mark,Mark,"Brown for first course, white for pudding. Brown is savoury, white's the treat. 'Course I'm the one who's laughing because I actually love brown toast.",Kitchen
1,2,Jeremy,Jeremy,There he is.,Kitchen
1,2,Mark,Jeremy,Dr. J!,Kitchen
1,2,Jeremy,Mark,"Good morning, Mark.",Kitchen
1,2,Mark,Jeremy,Sorry I didn't manage to hook up with you and Super Hans last night...,Kitchen
1,2,Jeremy,Jeremy,"Wedge of ballast, then bed again.",Kitchen
1,2,Mark,Jeremy,"then Barbara pops up with ""Is the Birbeck file ready yet?""",Kitchen
1,2,Jeremy,Jeremy,It's a bit like the crusher in Star Wars but red hot. What if Mum and Dad were trapped in one and I had a big hook I could swing down to rescue one of them. Who would I pick?,Kitchen
1,2,Mark,Jeremy,"I didn't get a chance to tell you the good news. Yeah, there's a vacancy going for a clerical assistant and I've managed to swing you an interview.",Kitchen
1,2,Jeremy,Mark,Uh-huh.,Kitchen
1,2,Jeremy,Jeremy,"Clerical assistant? I can't be a clerical assistant. I'm a musician. You wouldn't ask the Chemical Brothers to do your laundry for you, they'd be off their tits.",Kitchen
1,2,Mark,Jeremy,So is tomorrow at eleven all right?,Kitchen
1,2,Jeremy,Mark,"Tomorrow at eleven. Yeah, sure. I'll set the video.",Kitchen
