Season,Episode,Speaker,To,Line,Location
4,4,Mark,Mark,"Obviously, of course. Why didn't I just buy an anvil and smash my face onto it? It would certainly be less hassle.",School Reunion
4,4,Mark,Foz,So have you got kids?,School Reunion
4,4,Foz,Mark,"Not yet, why?",School Reunion
4,4,Mark,Foz,"Oh, no reason. I mean, I love kids. Not in a bad way, in a nice way. I mean I'm not on the child protection register... yet! Which proves I'm not a paedo!",School Reunion
4,4,Mark,Mark,This is going horribly. Need a joke.,School Reunion
4,4,Mark,Foz,Either that or I'm an incredibly-hard-to-detect paedo.,School Reunion
4,4,Mark,Mark,Just move on from the paedo area entirely.,School Reunion
4,4,Mark,Jeremy,"Jez, this is Foz and Sally, Jeremy.",School Reunion
4,4,Foz,Jeremy,"All right, mate. So, you're mates with Wankathon?",School Reunion
4,4,Jeremy,Foz,I'm sorry?,School Reunion
4,4,Foz,Mark,"Mark Wankathon, you remember? At school, when you got taught the wrong way to rub one out and you tried it for two hours.",School Reunion
4,4,Jeremy,Jeremy,"Shit, this is just like school. Have to side with the powerful to survive.",School Reunion
4,4,Jeremy,Foz,Ha ha ha two hours!,School Reunion
4,4,Foz,Sally,"Oh, I fucking hate this track, it's brilliant. Come on saucepot.",School Reunion
4,4,Mark,Mark,"Oh, just like school. I have to sit and watch while the beautiful people dance at me. Except no, she wants me to call her. It's worked. All my references to how much above the national average income I earn have actually worked!",School Reunion
4,4,Jeremy,Jeremy,"Oh yeah, making smoothies at The Orgazoid's house. This is the kind of job I deserve. I've paid my dues. All those years signing on every bloody week.",Russell's House
4,4,Russell,Jeremy,"Ah nice, thanks man. Yeah, take five if you want. Swim a few lengths.",Russell's House
4,4,Jeremy,Russell,"Oh, cheers, Russell. Yeah, maybe I will.",Russell's House
4,4,Jeremy,Jeremy,"Nothing dodgy about this. Just going for a swim in my trunks. I can't swim in a three-piece suit, so screw you, cynics.",Russell's House
4,4,Russell,Jeremy,"Ah now listen, before I forget. I thought you might like this. I did a few different versions of Borneo Function that never got released. I thought you might get a kick out of them.",Russell's House
4,4,Jeremy,Russell,Oh my God.,Russell's House
4,4,Jeremy,Jeremy,"Wow, Super Hans is gonna shit a brick when I show him this. Finally, something to beat that car battery he nicked off The Prodigy.",Russell's House
4,4,Mark,Sally,"OK, well great chatting to you, Sally.",Living Room
4,4,Jeremy,Mark,"Hi, honey, I'm home.",Living Room
4,4,Mark,Sally,And good luck with Midnight's Children. Remember no one's ever actually finished it. Bye.,Living Room
4,4,Mark,Mark,"Great call, friendly but flirty. Didn't overstep the mark. I could show Sophie the transcript. Maybe I should start taping my phone calls. No, Mark. That's how they got Nixon.",Living Room
4,4,Mark,Jeremy,What's that?,Living Room
4,4,Jeremy,Mark,"Oh, just a jumper Russell got for me.",Living Room
4,4,Mark,Jeremy,He bought you a jumper? What else has he bought you?,Living Room
4,4,Jeremy,Mark,"Nothing, Jesus. A squash racquet.",Living Room
4,4,Mark,Jeremy,"Jeremy, what's going on? Squash racquets are not a normal form of remuneration.",Living Room
4,4,Jeremy,Mark,"He doesn't have anyone to play with. And two people can't share one bloody racquet. Case closed, Columbo.",Living Room
4,4,Mark,Jeremy,"So listen, I've organised a trip to the safari park on Saturday with Sally and Foz.",Living Room
4,4,Jeremy,Mark,The safari park? With that dickhead Foz? Have you gone mental?,Living Room
4,4,Mark,Jeremy,It's an ironical day out.,Living Room
4,4,Jeremy,Mark,"Oh, I get it. You're just another dirty dog like everyone else.",Living Room
4,4,Mark,Jeremy,I am not a dirty dog. But I do need you to come. As my... sheath.,Living Room
4,4,Jeremy,Mark,Your sheath?,Living Room
4,4,Mark,Jeremy,"Yes, as long as you are there, it's just four people having an apparently nice time at an outdated venue.",Living Room
4,4,Jeremy,Mark,"Fucking hell, what's going on? Are you trying to get your end away while Sophie's not here?",Living Room
4,4,Mark,Jeremy,"Sophie has not called me once yet. So there is actually a perfectly valid excuse for what I'm almost certainly not going to try to do, OK?",Living Room
4,4,Jeremy,Mark,"OK, if Sally was sitting here now, and she said, Mark, let's do it, what would you say?",Living Room
4,4,Mark,Jeremy,If she promised she wasn't a Glenn Close type and happened to have a recent clean AIDS certificate?,Living Room
4,4,Jeremy,Mark,Yes.,Living Room
4,4,Mark,Jeremy,That's a hypothetical question. I don't answer hypothetical questions.,Living Room
4,4,Jeremy,Mark,You're disgusting. But I like it. It's like going to a strip joint with the Pope.,Living Room
4,4,Foz,Sally,A fucking safari park?,Safari Park
4,4,Sally,Foz,"It's cool, it's retro.",Safari Park
4,4,Mark,Sally,Exactly.,Safari Park
4,4,Mark,Mark,What exactly is my plan here? Lured them all to the safari park like a Bond villain. But what's the aim? Torture myself with contact with an unattainable woman? Or... what?,Safari Park
4,4,Jeremy,Mark,"Yeah, I wasn't sure if I was gonna make it because of my job, but my boss was actually really cool about it.",Safari Park
4,4,Mark,Jeremy,That's because it's not a real job.,Safari Park
4,4,Jeremy,Mark,"Oh yeah, what about this? Is that real enough for you?",Safari Park
4,4,Mark,Jeremy,"Don't flaunt your wad, Jeremy, it's not becoming.",Safari Park
4,4,Jeremy,Mark,Well you're becoming a pain in the arse. How do you like that?,Safari Park
4,4,Foz,Mark,"Ha ha ha ha, you wanker, Corrigan.",Safari Park
4,4,Mark,Jeremy,Hey!,Safari Park
4,4,Jeremy,Mark,See how much money you earned this week.,Safari Park
4,4,Mark,Jeremy,"Give it back, Jeremy!",Safari Park
4,4,Jeremy,Mark,"Not a lot in here, Mark, apart from a couple of moths.",Safari Park
4,4,Mark,Jeremy,Give that back!,Safari Park
4,4,Jeremy,Mark,"Oops, butterfingers.",Safari Park
4,4,Mark,Jeremy,"Jeremy, for God's sake.",Safari Park
4,4,Mark,Foz,"Foz, stop the car. Stop the car, Foz. He's- he's thrown my wallet out.",Safari Park
4,4,Foz,Mark,"Oh my God, he never!",Safari Park
4,4,Sally,Foz,"Stop the car, Foz. It's Mark's wallet!",Safari Park
4,4,Jeremy,Mark,You gonna go and get it?,Safari Park
4,4,Mark,Jeremy,"No, we need to call the... warder.",Safari Park
4,4,Jeremy,Mark,Don't be a dick. Go and get it.,Safari Park
4,4,Mark,Jeremy,What if the lions eat me?,Safari Park
4,4,Foz,Mark,"The lions aren't gonna eat you, Mark. Just nip and get it.",Safari Park
4,4,Mark,Jeremy,You should go and get it.,Safari Park
4,4,Jeremy,Mark,I'm not gonna get it.,Safari Park
4,4,Mark,Jeremy,Why should I have to bloody get it?,Safari Park
4,4,Foz,Mark,"Come on, Mark, just get it. Get it.",Safari Park
4,4,Jeremy,Mark,"Get it, get it, get it, get it, get it, get it, get it, get it, get it! Ha ha ha ha ha ha!",Safari Park
4,4,Mark,Jeremy,Fucking hell.,Safari Park
4,4,Jeremy,Jeremy,"Wow, I'm getting big laughs off humiliating my best mate. How can something so wrong feel so right?",Safari Park
4,4,Mark,Mark,"Shit, this isn't good. There are lions, there are lions everywhere. Where are they? Is there one behind that tree? Jeremy's literally thrown me to the bloody lions. What's next, crucifixion? Is he gonna have me actually nailed onto a cross?",Safari Park
4,4,Mark,Foz,You bloody bastards! Stop! Let me in! You bloody bastards!,Safari Park
4,4,Sally,Foz,"It's not funny, Foz. For fuck's sake, just stop.",Safari Park
4,4,Foz,Sally,"All right, all right, all right. Hold on here he comes, here he comes.",Safari Park
4,4,Foz,Mark,Wahey!,Safari Park
4,4,Mark,Mark,"Christ, what do you do to avoid lion attack? Soil yourself? Or is that grizzly bears? Hate to shit myself for no reason and get eaten. The final humiliation.",Safari Park
4,4,Mark,Mark,Still nothing from Sophie. Probably busy boning Jeff in Frankfurt. Highly unlikely but possible. I should at least try to feel jealous and betrayed. Then I'll feel less of a shit about pursuing Sally.,Kitchen
4,4,Mark,Jeremy,"Oh, hi Jez. ",Kitchen
4,4,Mark,Nancy,Nancy.,Kitchen
4,4,Mark,Jeremy,"You're here, I thought you'd be down at The Orgazoid's.",Kitchen
4,4,Jeremy,Mark,"Well actually Russell had to go off to Norway this morning, so I'm just here. Is that all right, Dad?",Kitchen
4,4,Mark,Jeremy,"Well, yeah, but are you all right?",Kitchen
4,4,Jeremy,Mark,"Yes, I'm fine.",Kitchen
4,4,Mark,Mark,What's bothering him? He's thinking about something. He never normally thinks about things.,Kitchen
4,4,Nancy,Jeremy,So will you ask him now?,Kitchen
4,4,Jeremy,Mark,Is it OK if Nancy uses the computer to redo her CV?,Kitchen
4,4,Mark,Jeremy,My computer?,Kitchen
4,4,Jeremy,Mark,"Your computer, the computer, whatever.",Kitchen
4,4,Mark,Mark,Sally!,Kitchen
4,4,Mark,Nancy,Sure.,Kitchen
4,4,Mark,Sally,Hello?,Kitchen
4,4,Sally,Mark,"Hi Mark, how you doing?",Kitchen
4,4,Mark,Sally,"Oh good, good thanks.",Kitchen
4,4,Sally,Mark,"Listen, I'm so sorry about yesterday.",Kitchen
4,4,Mark,Sally,"Oh, don't worry, that's fine. It was funny, probably, if it hadn't been happening to me, it might have been funny.",Kitchen
4,4,Sally,Mark,"But look, it was great seeing you, and it would be great to meet up again.",Kitchen
4,4,Mark,Sally,"Oh right, well, I'd love to.",Kitchen
4,4,Sally,Mark,How about tomorrow? I could drop around to your flat about three?,Kitchen
4,4,Mark,Sally,"Yeah, the flat, that sounds lovely.",Kitchen
4,4,Mark,Mark,"I can't invite her around here. Anyone could be here. Sophie will find out. Nothing's gonna happen, but nothing must remain a total secret.",Kitchen
4,4,Sally,Mark,"So, what's your address?",Kitchen
4,4,Mark,Sally,"My address, hold on let me just check.",Kitchen
4,4,Sally,Mark,You need to check your address?,Kitchen
4,4,Mark,Sally,"Well, I do like to be totally accurate.",Kitchen
4,4,Mark,Jeremy,"Jez, what's Orgazoid- Russell's address?",Kitchen
4,4,Jeremy,Mark,Why?,Kitchen
4,4,Mark,Jeremy,Just give it to me.,Kitchen
4,4,Jeremy,Mark,"No, why.",Kitchen
4,4,Mark,Jeremy,"Because I'm a dirty dog, all right.",Kitchen
4,4,Jeremy,Mark,31 Bishop's Avenue.,Kitchen
4,4,Mark,Sally,"Hey, 31 Bishop's Avenue.",Kitchen
4,4,Sally,Mark,"Ooh, posh. So, see you tomorrow.",Kitchen
4,4,Mark,Sally,"Yep, see you there th- here then.",Kitchen
4,4,Sally,Mark,Bye.,Kitchen
4,4,Mark,Jeremy,"All right, so Jez, do you think it'll be all right if I sort of borrowed Russell's house?",Kitchen
4,4,Jeremy,Mark,"No, I don't particularly want to go to that place right now if I'm honest.",Kitchen
4,4,Mark,Jeremy,"Well that's OK, if you'd prefer, you can just give me the keys and I'll-",Kitchen
4,4,Jeremy,Mark,"No, you need me to do the alarms, and there's like six different alarms, but I'm just feeling a bit weird about the whole situation.",Kitchen
4,4,Mark,Jeremy,Yeah? Why?,Kitchen
4,4,Jeremy,Mark,"Well, as it turns out, there were, there are certain additional duties which I was expected to perform.",Kitchen
4,4,Mark,Jeremy,"Duties, what duties?",Kitchen
4,4,Jeremy,Mark,"Well, you know, I'm his handyman.",Kitchen
4,4,Mark,Jeremy,Yes.,Kitchen
4,4,Jeremy,Mark,"It's just, he did expect me to... give him a... hand.",Kitchen
4,4,Mark,Jeremy,You gave him a hand?,Kitchen
4,4,Jeremy,Mark,I helped him out.,Kitchen
4,4,Mark,Jeremy,"You helped him out by giving him a hand. Wow, just to clarify, you do mean...",Kitchen
4,4,Jeremy,Mark,Yes.,Kitchen
4,4,Mark,Jeremy,Shit.,Kitchen
4,4,Mark,Mark,"I knew it, I knew it, I knew it!",Kitchen
4,4,Jeremy,Mark,"And now I don't know what to do. 'Cause on the one hand- one the one hand it's a really good job. But on the other, I don't really want to go back to that place or have anything to do with him.",Kitchen
4,4,Mark,Jeremy,"God, that's a really a tough decision.",Kitchen
4,4,Mark,Mark,"Stay, stay so I can use the house.",Kitchen
4,4,Jeremy,Mark,"I got Super Hans to fill in yesterday. Said I was sick. There's loads needs doing before he comes back, but I just feel a bit dirty, you know.",Kitchen
4,4,Mark,Jeremy,"Mm-hmm, yeah. I know what you mean, I feel the same sometimes when I come back from JLB and I've had to do loads of spreadsheets.",Kitchen
4,4,Jeremy,Mark,"I don't think it is the same, Mark. I feel like my soul is being chipped away bit by bit.",Kitchen
4,4,Mark,Jeremy,"Welcome to the world of work, Jeremy. You know, you don't have to be crazy to work here, but it helps.",Kitchen
4,4,Jeremy,Mark,"And you don't have to be a smackhead to wank off old geezers, but that probably helps too.",Kitchen
4,4,Super Hans,Jeremy,Why didn't you tell me about the wanking off bit?,Flat
4,4,Jeremy,Super Hans,"Sorry, I didn't think.",Flat
4,4,Super Hans,Jeremy,Well you should have bloody thought. Jesus.,Flat
4,4,Jeremy,Super Hans,Did you... do it?,Flat
4,4,Super Hans,Jeremy,Of course I did. How'd you think I got these trainers?,Flat
4,4,Nancy,Super Hans,What's going on? Who is wanking who off?,Flat
4,4,Super Hans,Nancy,Jeremy's been wanking off this bloke for cash.,Flat
4,4,Jeremy,Nancy,No I haven't! It's not-,Flat
4,4,Nancy,Jeremy,Jeremy that is so you. I always knew you'd end up doing something like that.,Flat
4,4,Jeremy,Nancy,What do you mean that is so me? That is not so me.,Flat
4,4,Jeremy,Jeremy,"So I have to jerk him off, but at least I get a lift home. Never mind. Only a few hand shandies between me and a home studio.",Russell's Car
4,4,Russell,Jeremy,I had a chance to think in Norway. Erm... about us.,Russell's Car
4,4,Jeremy,Russell,Us? Yeah?,Russell's Car
4,4,Russell,Jeremy,"I've never had to pay for it before, and I don't think I want to pay for it with you.",Russell's Car
4,4,Jeremy,Russell,"Oh, right, so can I stop doing it?",Russell's Car
4,4,Russell,Jeremy,"Well, I want you to keep doing it, but I want you to do it because you want to do it.",Russell's Car
4,4,Jeremy,Russell,It's just I don't really want to do it. Could I start wearing a mitten? Or maybe chuck a flannel over it?,Russell's Car
4,4,Russell,Jeremy,It's just really difficult for me because I really like you. I just don't think we should see each other for a while. I'm going away to get my head together.,Russell's Car
4,4,Jeremy,Russell,"No, but the thing is I really like you too. I've been hiding my true feelings, even from myself, but now they're all coming out. What a lot of feelings!",Russell's Car
4,4,Russell,Jeremy,"I'm sorry, Jez.",Russell's Car
4,4,Jeremy,Jeremy,Home studio slipping away.,Russell's Car
4,4,Jeremy,Russell,"No really, I mean it. I mean I like you. I mean fuck that, I love you. And I want to have sex with you.",Russell's Car
4,4,Russell,Jeremy,No Jeremy.,Russell's Car
4,4,Jeremy,Russell,"Come on, mate, let me have a go on the old gear stick. I'll take it up to fourth.",Russell's Car
4,4,Russell,Jeremy,"This is not what I want. Fuck off, Jez.",Russell's Car
4,4,Jeremy,Jeremy,"So, as it stands, I'm failing to find work as a prostitute. That doesn't feel good. Still, got his house keys. If I keep working for him, he'll have to keep paying me.",Russell's Car
4,4,Sally,Mark,So this is your flat?,Russell's House
4,4,Mark,Sally,"This is it. I call it a flat because I'm quite modest, but as you can see, it's actually quite a massive house.",Russell's House
4,4,Mark,Mark,"Shit, am I seriously hoping to have sex with Sally Slater? This is all very wrong.",Russell's House
4,4,Sally,Mark,"I always knew you'd do well for yourself, Mark, but this is amazing.",Russell's House
4,4,Mark,Mark,"Relax, you don't go to adulterer's prison for drinking tea and playing Connect Four.",Russell's House
4,4,Sally,Mark,"And Jeremy, is he like your butler?",Russell's House
4,4,Mark,Sally,"There's not much else he can do in the real world, and I've been very lucky and I like to spread that around.",Russell's House
4,4,Mark,Mark,Glad I sprayed my nuts with aftershave though. You never know how things might turn out. I'm no Nostradamus.,Russell's House
4,4,Sally,Mark,I never knew you were into stuff like this.,Russell's House
4,4,Mark,Sally,"Oh, I just really appreciate the male form.",Russell's House
4,4,Sally,Mark,"Right, you know even I think it's kind of beautiful I suppose.",Russell's House
4,4,Mark,Sally,"Yeah, there is something beautiful about the male member. It's good to have a look at it now and again. A reminder of what can happen if you're not careful.",Russell's House
4,4,Mark,Mark,What am I saying? At least he's going. Don't need a witness to this fiasco.,Russell's House
4,4,Mark,Sally,"Here, Sally, I got you a present. Hitchhiker's Guide, it's the same copy we read from at Sutton Hoo. I got it signed by Douglas Adams when he came to the big WH Smiths.",Russell's House
4,4,Sally,Mark,"Oh, this is, it's lovely. Thank you, it's so romantic. It's the perfect way to start our affair.",Russell's House
4,4,Mark,Sally,"Our affair? OK, that sounds good. What sort of affair were you thinking of? The Dreyfus Affair or more like the Watergate Affair? 'Cause I can tell you right now I'm not burgling any Democrats.",Russell's House
4,4,Sally,Mark,"Relax, we both want it to happen.",Russell's House
4,4,Mark,Mark,"Oh my God, she's gonna kiss me. I'm such a bastard. I'm meant to be getting married. I'm out of my depth. I thought she was a frightened, little suburban mouse. But no, she's my nightmare. A liberated, sexually adventurous urban woman.",Russell's House
4,4,Mark,Sally,"Oh, Sally, Look, I'm really not sure I...",Russell's House
4,4,Mark,Mark,"What am I doing? This isn't me, I can't have an affair. I'm not French. I'm the least French person on the planet. My favourite cheeses are Cheddar and Red Leicester.",Russell's House
4,4,Mark,Sally,"Look, no, I'm sorry Sally. I just don't know if I can do this. I mean, you've got your miserable relationship and the truth is I have got one of my own. And I just feel that, you know, if it ain't broke, don't fix it. And even if it is broke, just ignore it and maybe it'll be sort of OK? Like the environment. Who's that?",Russell's House
4,4,Mark,Mark,Is Russell back? Oh no!,Russell's House
4,4,Mark,Sally,Foz!,Russell's House
4,4,Sally,Mark,"Shit, he's fucking followed me again. He's obsessed with the idea that I'm screwing around on him.",Russell's House
4,4,Mark,Sally,"Well, I mean, I suppose you are sort of trying to. Look, the door's locked and...",Russell's House
4,4,Jeremy,Foz,Foz?,Russell's House
4,4,Foz,Jeremy,Where's Sally?,Russell's House
4,4,Mark,Mark,"Great, thanks Jeremy.",Russell's House
4,4,Foz,Sally,Sally!,Russell's House
4,4,Sally,Mark,"Shit, hide! I'll just say I'm working here cleaning.",Russell's House
4,4,Mark,Sally,"I can't hide, I'm not a good hider.",Russell's House
4,4,Mark,Mark,What the hell am I doing? I'm doing a Jeremy. This is a wake-up call. I've definitely hit a new low.,Russell's House
4,4,Sally,Foz,"Foz, what are you doing here?",Russell's House
4,4,Foz,Sally,What the fuck are you doing here? Are you screwing wankathon's mate?,Russell's House
4,4,Sally,Foz,"Of course I'm bloody not. I'm cleaning, you arsehole. This is Mark's flat, and Jeremy's his servant.",Russell's House
4,4,Jeremy,Sally,"Well, not servant really, more of a-",Russell's House
4,4,Mark,Mark,"Shit, now she calls.",Russell's House
4,4,Foz,Jeremy,What's that?,Russell's House
4,4,Jeremy,Foz,That's just the normal ringing noise. That's normal.,Russell's House
4,4,Foz,Jeremy,Yeah?,Russell's House
4,4,Mark,Mark,Must hide more. Can't hide more.,Russell's House
4,4,Foz,Mark,"Corrigan, are you spying on my wife? Are you wanking over her?",Russell's House
4,4,Mark,Foz,"Er... yes, yeah that's what I'm doing. I'm spying on her and wanking over her.",Russell's House
4,4,Foz,Mark,"You really are a filthy, little perv, aren't you?",Russell's House
4,4,Mark,Foz,"Uh-huh, I suppose so.",Russell's House
4,4,Foz,Sally,"Come on, we're going.",Russell's House
4,4,Mark,Mark,"Wow, he didn't hit me. Bit disappointing. I sort of deserve to be hit.",Russell's House
4,4,Jeremy,Mark,"Cheer up, Mark. At least now you've got a funny story to tell people.",Russell's House
4,4,Mark,Jeremy,"Yes, no, I guess this is a pretty funny story.",Russell's House
4,4,Mark,Mark,"One that I'll never, ever tell anyone because of my deep and burning shame.",Russell's House
4,5,Mark,Mark,"Ugh, more data entry tonight. I guess the only good thing is that my life is so boring it feels like it might go on forever. Maybe I'll put on Big Bond Themes and pretend I'm data entering for MI6.",Apollo House
4,5,Jeremy,Mark,"Hi honey, you're home!",Flat
4,5,Mark,Jeremy,Hi Jez.,Flat
4,5,Jeremy,Mark,"So, listen, you know how depressed you are about getting married?",Flat
4,5,Mark,Jeremy,"What? Let's not drag that up now, I'm looking forward to it, that's the line. Besides, it's possible I might have found a way out.",Kitchen
4,5,Jeremy,Mark,"It's in four weeks, Mark. It's going to happen. Look, no matter how unpalatable it may be, the fact is, I'm your best friend. And I know you don't wanna hear it but, I love you. And, in your own dried up, desiccated, weird and unfriendly way, you love me too. So, I've got together my last scraps of cash to give you the stag weekend of your dreams!",Kitchen
4,5,Mark,Jeremy,Really?,Kitchen
4,5,Jeremy,Mark,"Yes. I've booked us a canal boat near an Iron Age area, and you can go and look at the Iron Age or whatever it is you do, and I'll make us some steaks. And I've sent off for a chess set and I'll learn how to play but, if I'm not good enough, then there's a computer setting. Or, I'll be pretending to play but really you'll be playing the computer. OK?",Kitchen
4,5,Mark,Jeremy,"Well, well that's nice. That actually sounds fun. Unfortunately, as I said, I think I might not be getting married, after all.",Kitchen
4,5,Jeremy,Mark,Oh?,Kitchen
4,5,Mark,Jeremy,"Yeah, Sophie's twigged something's ""not right"" and she's arranged for us to see a relationship counsellor.",Kitchen
4,5,Jeremy,Mark,"Right, and yet you seem excited because...?",Kitchen
4,5,Mark,Jeremy,Because it's all gonna come out! The whole disgusting mess. She'll wheedle it all out. It'll take hours to break me down but then it'll all spill out and Sophie won't be able to shout at me because there'll be a professional there. And none of it's even my fault! It's all my so-called subconscious.,Kitchen
4,5,Counsellor,Mark,"I want you both to relax. This is just a safe place where I'm going to listen to whatever you have to say, however you want to say it...",Therapist's
4,5,Mark,Mark,"Oh yeah, here we are. The Field of Screams, the torture chamber. The emotional dungeon.",Therapist's
4,5,Counsellor,Mark,"You've got this wedding coming up, how are you both feeling?",Therapist's
4,5,Mark,Counsellor,"Oh, she is good. Here it comes, let it all flood out. Just, gently.",Therapist's
4,5,Counsellor,Mark,Mark?,Therapist's
4,5,Mark,Counsellor,"Me? Oh, I'm feeling pretty positive. Obviously, some tiny doubts...",Therapist's
4,5,Mark,Mark,Don't overdo it.,Therapist's
4,5,Mark,Counsellor,...mainly about the catering.,Therapist's
4,5,Counsellor,Mark,"Well, that seems perfectly normal.",Therapist's
4,5,Counsellor,Sophie,"Sophie, how about you?",Therapist's
4,5,Sophie,Counsellor,"Um, well, I just wish I felt that comfortable...",Therapist's
4,5,Mark,Mark,"Hold on, is that it? Is that my go finished? Did she just believe what I said? What kind of counselling is that? She didn't wheedle anything out of me! How am I supposed to blow my emotional beans if she doesn't at least give me a wheedle?",Therapist's
4,5,Counsellor,Mark,"Plus, obviously, Sophie mentioned on the phone about the sexual problems in your relationship.",Therapist's
4,5,Mark,Counsellor,I'm sorry?,Therapist's
4,5,Counsellor,Mark,The sexual problems in your relationship.,Therapist's
4,5,Mark,Counsellor,"Oh, right, are there?",Therapist's
4,5,Sophie,Mark,"Um, well, I just feel, I don't know. Unfulfilled.",Therapist's
4,5,Mark,Sophie,Unfilled?,Therapist's
4,5,Sophie,Mark,Unfulfilled.,Therapist's
4,5,Mark,Counsellor,"Right, well, I mean, I suppose I thought that maybe Sophie might be one of those women who find it difficult, or even impossible to attain- to achieve-",Therapist's
4,5,Sophie,Mark,"No, I'm definitely not one of those.",Therapist's
4,5,Mark,Sophie,Right.,Therapist's
4,5,Counsellor,Sophie,What would you say if you felt that you weren't going to be judged?,Therapist's
4,5,Sophie,Counsellor,"I'd say, I'd say, um...",Therapist's
4,5,Mark,Mark,This isn't gonna be good.,Therapist's
4,5,Sophie,Counsellor,"Often, Mark, you ejaculate quite a long time before I've had time to feel like I've started to enjoy our sex.",Therapist's
4,5,Mark,Sophie,"Uh-huh. Thanks for that, Soph. Great, well, I'll make a note of that.",Therapist's
4,5,Mark,Counsellor,"Well, this has been great, just a great time.",Therapist's
4,5,Counsellor,Mark,"Mark, it's all right, we've got forty-five minutes yet.",Therapist's
4,5,Mark,Counsellor,"Really, forty-five minutes?",Therapist's
4,5,Mark,Mark,"Oh great, so I'll be spending one pound a minute to hear how shit I am at sex. Now that's value for money.",Therapist's
4,5,Mark,Jeremy,So good to just get away.,Canal Boat
4,5,Jeremy,Mark,"Oh yeah, the Stag Aquatic. So, come on, let's max out the engine a bit. Tear it up.",Canal Boat
4,5,Mark,Jeremy,"Actually, this is almost top speed.",Canal Boat
4,5,Jeremy,Mark,What if we hit trouble?,Canal Boat
4,5,Mark,Jeremy,"I don't think we're going to hit trouble on the Shropshire Union Canal, Jeremy.",Canal Boat
4,5,Jeremy,Mark,"Right, but this is just it? This is totally it? There's not gonna be any waves or mad shit?",Canal Boat
4,5,Mark,Jeremy,No.,Canal Boat
4,5,Jeremy,Mark,Can I water ski off the back?,Canal Boat
4,5,Mark,Jeremy,You're very welcome to try.,Canal Boat
4,5,Jeremy,Mark,"Jesus. Well let's stop here, then, and go for a drink.",Canal Boat
4,5,Mark,Jeremy,"Jez, it's ten in the morning!",Canal Boat
