Season,Episode,Speaker,To,Line,Location
4,5,Jeremy,Mark,"Well, what else are we gonna do? Just sit here freezing out nuts off, talking to each other? I mean, what the hell are we gonna talk about?",Canal Boat
4,5,Mark,Jeremy,"I dunno, stuff! Banter, chat. Isn't that what you had in mind when you organised this thing?",Canal Boat
4,5,Jeremy,Mark,"Sure, yeah, I suppose. So how do you feel now the wedding's back on track?",Canal Boat
4,5,Mark,Jeremy,Not that.,Canal Boat
4,5,Jeremy,Mark,"Oh, right, not that. Well, what then? I can't think of anything to say. You start.",Canal Boat
4,5,Mark,Jeremy,"Hey, is that a kingfisher?",Canal Boat
4,5,Jeremy,Mark,"Oh, for God's sake. If we're gonna talk, let's talk about something proper, like films.",Canal Boat
4,5,Mark,Mark,"Ugh, films. Another hour of my life gone trying to explain to him what The Matrix is.",Canal Boat
4,5,Jeremy,Jeremy,This weekend is gonna be one massive dry hump. Maybe the pressure will build to the point where we actually try to fuck each other.,Canal Boat
4,5,Mark,Jeremy,"Jeremy, you promised you'd play with apparent enthusiasm.",Canal Boat
4,5,Jeremy,Mark,"Yeah, well, I'm sorry. You can so tell this game is over a thousand years old.",Canal Boat
4,5,Mark,Jeremy,"Yes, it's very sophisticated. It's your move.",Canal Boat
4,5,Jeremy,Mark,I don't wanna play any more.,Canal Boat
4,5,Mark,Jeremy,Because I'm winning?,Canal Boat
4,5,Jeremy,Mark,"No, not because you're win- I don't even know who's winning! Here, Mark, I'll tell you what. You piss in this bottle, I'll drink it.",Canal Boat
4,5,Mark,Jeremy,What? What the hell for?,Canal Boat
4,5,Jeremy,Mark,"For a laugh, it's the stag.",Canal Boat
4,5,Mark,Jeremy,"No, Jez, if you drank my piss, I'd feel violated.",Canal Boat
4,5,Jeremy,Mark,"Oh, that is great. You wouldn't even let me drink your piss. I'm not trying to kiss you, Mark. It's liquid waste.",Canal Boat
4,5,Mark,Jeremy,"I'm sorry, but no.",Canal Boat
4,5,Jeremy,Mark,You wouldn't let me drink your piss?,Canal Boat
4,5,Mark,Jeremy,Why would you even want to drink my piss?,Canal Boat
4,5,Jeremy,Mark,For a laugh!,Canal Boat
4,5,Mark,Jeremy,What the hell made you think of that?,Canal Boat
4,5,Jeremy,Mark,"I'm just bored, OK? I'd let you drink my piss.",Canal Boat
4,5,Mark,Jeremy,"Well, thank you very much.",Canal Boat
4,5,Jeremy,Mark,"Oh, come on, let's get out of here. It's doing our nuts in. Let's go and get you some sweet punani action.",Canal Boat
4,5,Mark,Jeremy,I don't want sweet punani action. I wanna take your bishop and grind you down.,Canal Boat
4,5,Jeremy,Mark,"Here, look, take it. And the horsey. Come on, man! Couple of pints, couple of hotties, yeah? Come on tiger, let's roar!",Canal Boat
4,5,Mark,Mark,"Oh, God, I wish I lived with the chess computer. The chess computer wouldn't make me do things.",Canal Boat
4,5,Jeremy,Mark,I'm stagging you. I'm stagging you by the back door. This is your stag,Pub
4,5,Mark,Jeremy,"I don't want a hangover, Jeremy. I want to be almost asleep by eleven o'clock.",Pub
4,5,Jeremy,Others,"Two yards of ale, please. It's his stag.",Pub
4,5,Mark,Jeremy,"Yards, really?",Pub
4,5,Jeremy,Mark,"Hello. Check it out, Mark.",Pub
4,5,Mark,Jeremy,"Oh, yeah. They're eating.",Pub
4,5,Jeremy,Mark,Let's go and say hello.,Pub
4,5,Mark,Jeremy,"No, let's definitely not.",Pub
4,5,Jeremy,Mark,"Come on, man.",Pub
4,5,Mark,Jeremy,"No, look, really, they're eating, we're drinking.",Pub
4,5,Jeremy,Mark,They want it.,Pub
4,5,Mark,Jeremy,"Look, Jeremy, the whole world isn't Zoo magazine. Everyone isn't just walking around wanting it the whole time. People have a wide range of emotional states.",Pub
4,5,Jeremy,Mark,Like what?,Pub
4,5,Others,Jeremy,There you go.,Pub
4,5,Mark,Jeremy,"Well, they might be feeling pensive or full of hubris, melancholic, amused, or just numb.",Pub
4,5,Jeremy,Mark,"Bollocks, they're hot and they want it. Come on.",Pub
4,5,Mark,Jeremy,God!,Pub
4,5,Jeremy,Aurora,"Hey there, we just wondered, if you don't mind hanging out with a couple of yardies, whether maybe we could join you for a drink.",Pub
4,5,Mark,Aurora,I'm very sorry.,Pub
4,5,Aurora,Jeremy,Why not?,Pub
4,5,Mark,Mark,"Oh, God, this is awful. It's so obvious. We don't just want to chat, it's not just friendly. They know exactly what we're doing. And the horrible thing is, they don't even seem to mind.",Pub
4,5,Aurora,Jeremy,"I'm Aurora, and this is my sister, Lucy.",Pub
4,5,Jeremy,Aurora,Jez and Mark.,Pub
4,5,Lucy,Mark,You're the first people to talk to us all night.,Pub
4,5,Aurora,Lucy,"Oh, apart from the British Kidney Foundation guy with the stickers.",Pub
4,5,Lucy,Aurora,"Yeah, right, Mr. Freebie, looking for a handout.",Pub
4,5,Jeremy,Aurora,"Yep, so, listen, what can I get you two? How about a foot of wine?",Pub
4,5,Lucy,Jeremy,Can I get a metre of vodka... with an inch of tonic?,Pub
4,5,Mark,Mark,"Come on, Mark, turn it on, play the game.",Pub
4,5,Mark,Lucy,"Oh, naughty, you've combined metric and imperial. You might get an interdenominational, you know, from mixing the two measurement systems, a hangover of that kind.",Pub
4,5,Mark,Mark,"Just stay mute, Mark. You're a social freak. Remain in your compound.",Pub
4,5,Aurora,Jeremy,So that's great you're in a band. What's it called?,Malcolm's Barge
4,5,Jeremy,Aurora,"Oh, right now we're called Various Artists, just to fuck over people with iPods. We think it'll set us back two or three years, which is cool.",Malcolm's Barge
4,5,Mark,Lucy,"So, you've got a great canal boat.",Malcolm's Barge
4,5,Jeremy,Lucy,"We're canalists, too, we love canaling.",Malcolm's Barge
4,5,Lucy,Jeremy,"Actually, it's our dad's.",Malcolm's Barge
4,5,Mark,Lucy,"Right, the upkeep must be a nightmare. I mean, the mooring costs alone would...",Malcolm's Barge
4,5,Jeremy,Jeremy,He really knows how to murder a vibe.,Malcolm's Barge
4,5,Aurora,Jeremy,You'll have to excuse Mummy.,Malcolm's Barge
4,5,Jeremy,Aurora,"Mummy? Wow, doesn't your mum mind the dog being called-",Malcolm's Barge
4,5,Aurora,Jeremy,"Oh God, no, Mum's dead. Mummy's just had lots of lovely babies, haven't you? Naughty, slutty Mummy.",Malcolm's Barge
4,5,Jeremy,Aurora,Right.,Malcolm's Barge
4,5,Lucy,Mark,So have you got a girlfriend?,Malcolm's Barge
4,5,Mark,Mark,"Technically, a fiancée's not a girlfriend.",Malcolm's Barge
4,5,Mark,Lucy,"Uh, you know, not really.",Malcolm's Barge
4,5,Lucy,Mark,"I had a boyfriend till last month. He was a bit hippie for my taste. Plus, a lot of um-ing and ah-ing, you know. So, one day I turned round to him and I said, ""Benny, it's time to shit, or get off the pot.""",Malcolm's Barge
4,5,Mark,Lucy,"Oh, right, and did he...?",Malcolm's Barge
4,5,Lucy,Mark,"Oh, yeah, like a shot.",Malcolm's Barge
4,5,Aurora,Lucy,"Luce, will you give me a hand looking for the secret bottle of voddy?",Malcolm's Barge
4,5,Mark,Mark,"Oh, God, vodka. It'll be an orgy. Great, disappoint three people instead of just one.",Malcolm's Barge
4,5,Jeremy,Mark,This is going great. Things are going to happen.,Malcolm's Barge
4,5,Mark,Jeremy,Nothing's happening.,Malcolm's Barge
4,5,Jeremy,Mark,"Look, just forget about Sophie, all right? You're allowed a freebie on the stag. Like Pej in Estonia.",Malcolm's Barge
4,5,Mark,Jeremy,"What, when he had sex with a prostitute and gave his wife that aggressive yeast infection?",Malcolm's Barge
4,5,Jeremy,Mark,"It's what people do, just get on with it.",Malcolm's Barge
4,5,Mark,Jeremy,"I don't like her, I don't fancy her.",Malcolm's Barge
4,5,Jeremy,Mark,"Do you think Pej fancied that hooker? Of course he didn't. But he didn't let that stop him, he did the right thing.",Malcolm's Barge
4,5,Mark,Jeremy,I just wanna go to bed.,Malcolm's Barge
4,5,Jeremy,Mark,"You can't go to bed, there are two of them, there has to be two of us, that's the law.",Malcolm's Barge
4,5,Mark,Jeremy,I'm gonna go to bed.,Malcolm's Barge
4,5,Jeremy,Mark,"You're not going anywhere, Mark. You can't say you're going to bed at nine in the evening. You're gonna sit there and smile, and talk about something funny you've seen on reality TV. And stop going on and on about the Euro. We're in it now, and there's nothing you can do about it, so just-",Malcolm's Barge
4,5,Mark,Jeremy,"We are not in the Euro, Jeremy. So you can have your squalid little night. I'm gonna go and read Roy Jenkins on Winston Churchill.",Malcolm's Barge
4,5,Aurora,Lucy,"Oh, here we go, Dad's back.",Malcolm's Barge
4,5,Malcolm,Aurora,"Ahoy, there!",Malcolm's Barge
4,5,Lucy,Aurora,"Ah, that's a shame. I was looking forward to having some fun.",Malcolm's Barge
4,5,Mark,Mark,"Dodged a bullet, there. Although, maybe not. My attraction to her is so minimal, for once, I might've been able to do it for hours. An endless, joyless fuck session.",Malcolm's Barge
4,5,Mark,Mark,"I'm not wearing them, they're Hitler's boots, I'm not wearing Hitler's boots. What the hell's going on? Why are we moving? Jeremy can't be up! Someone's trying to steal the boat! Pirates? I'm being shanghaied!",Canal Boat
4,5,Jeremy,Mark,"Morning, shipmate.",Canal Boat
4,5,Mark,Jeremy,"Jeremy, what the hell is going on?",Canal Boat
4,5,Jeremy,Mark,"Oh, just getting going. Couldn't let them get away, could we?",Canal Boat
4,5,Mark,Jeremy,"Oh, this is a new one. Water stalking.",Canal Boat
4,5,Jeremy,Mark,"It's not, it's just friendly.",Canal Boat
4,5,Jeremy,Aurora,"Ahoy there, shipmates!",Canal Boat
4,5,Aurora,Jeremy,Jeremy! Last one to lunch at the Lamb and Flag in Garsington is a loser!,Canal Boat
4,5,Jeremy,Aurora,Ha! You're on!,Canal Boat
4,5,Jeremy,Mark,"Warp factor three please, Scotty.",Canal Boat
4,5,Mark,Mark,"Oh, great, I'm Scotty. He's off crossbreeding with the beautiful aliens, and I'm stuck down in the engine room with the probably cancer-emitting fuel cells.",Canal Boat
4,5,Jeremy,Aurora,"So I'm not in a relationship right now. I've just been hurt too many times, you know?",Pub
4,5,Aurora,Jeremy,Really?,Pub
4,5,Jeremy,Aurora,"Yeah, it's like I've got a river of pain running through me, from here, right the way down to here. Kind of like Jim Morrison or Russell Brand.",Pub
4,5,Aurora,Malcolm,Dad? Jez has offered to do the shopping run and no one else is fit to drive.,Pub
4,5,Malcolm,Jeremy,Think you can handle a four by four?,Pub
4,5,Jeremy,Malcolm,"Sure, no sweat.",Pub
4,5,Jeremy,Jeremy,Four by four. Piece of piss. Probably.,Pub
4,5,Malcolm,Mark,So you're in the credit racket.,Pub
4,5,Mark,Malcolm,"Uh, yes, that's my racket.",Pub
4,5,Malcolm,Mark,"I should pick your brains because that's my new setup in Bangalore, a credit call centre.",Pub
4,5,Mark,Malcolm,"God, you've got fingers in so many pies. How do you keep track?",Pub
4,5,Lucy,Mark,"Dad comes up with the brainwave and then he hires a load of little people, who never went to university, to work out the details.",Pub
4,5,Mark,Mark,"I'm with the business elite, shitting on the little guy.",Pub
4,5,Mark,Lucy,"Wow, brilliant.",Pub
4,5,Malcolm,Mark,"I'm looking for an associate who can help me staff up. Have you got any contacts, anyone who could handle a management role out there?",Pub
4,5,Mark,Malcolm,"Oh, right, I'll have a think.",Pub
4,5,Mark,Mark,"Oh my God, India. Could be my way out. Goodbye Sophie, goodbye sexual humiliation, hello Corrigan the neo-colonial overlord.",Pub
4,5,Mark,Malcolm,I thought for a minute there you were gonna ask me.,Pub
4,5,Malcolm,Mark,"Pretty big step up for you, though, wouldn't it? I mean, you're kind of a numbers droid, aren't you?",Pub
4,5,Mark,Malcolm,"Not really, I'm-",Pub
4,5,Mark,Mark,"Oh my God, I've entered an interview situation and there's a hand near my cock. This is like that dream I had about Alan Sugar and the badger.",Pub
4,5,Mark,Malcolm,I have experience of managing a team.,Pub
4,5,Malcolm,Mark,"Yeah, but this would be 300-odd employees.",Pub
4,5,Mark,Malcolm,"Yes, but I've developed a portfolio of skills over the last three years which enable me to rise to new challenges with ease.",Pub
4,5,Mark,Mark,"Maybe this is a test. She can't actually fancy me. Or a trick. Maybe they're Johnson and Sophie wearing masks, and this is all being paid for by MTV and The Playboy Channel.",Pub
4,5,Jeremy,Jeremy,"God, look at me drive. I'm Clarkson.",Malcolm's 4x4
4,5,Aurora,Jeremy,Are you sure it's OK to put in unleaded? We always normally do diesel.,Malcolm's 4x4
4,5,Jeremy,Aurora,"Oh, trust me, these babies run on anything.",Malcolm's 4x4
4,5,Aurora,Jeremy,"So, after we dump the shopping, do you want to go for a little stroll?",Malcolm's 4x4
4,5,Jeremy,Aurora,Just the two of us?,Malcolm's 4x4
4,5,Aurora,Jeremy,Yeah.,Malcolm's 4x4
4,5,Jeremy,Aurora,Cool.,Malcolm's 4x4
4,5,Aurora,Jeremy,"Well, do you wanna turn this around and I'll see you in a sec?",Malcolm's 4x4
4,5,Jeremy,Jeremy,"Oh, God, I think I love her. I think I'm falling in love. Or getting a bone on, which is basically the same thing when you get rid of all the Valentine's cards and bullshit.",Malcolm's 4x4
4,5,Aurora,Others,"Come on, Mummy!",Malcolm's 4x4
4,5,Jeremy,Jeremy,"Oh yeah, pissed and stoned in a gas-guzzler. This is the life. Already given a quid to Greenpeace this year, so I'm golden. Not the dog, not the dog. Shit, the dog!",Malcolm's 4x4
4,5,Jeremy,Jeremy,"Oh, yeah, this is cool. Just don't think about the dead dog. If I don't think about it, there's always a chance it didn't happen.",Malcolm's 4x4
4,5,Aurora,Jeremy,"Let's roll, cowboy. Where's Mummy?",Malcolm's 4x4
4,5,Jeremy,Aurora,Mummy?,Malcolm's 4x4
4,5,Aurora,Jeremy,"Yeah, I let her out for a piss.",Malcolm's 4x4
4,5,Jeremy,Aurora,Are you sure she was with us?,Malcolm's 4x4
4,5,Aurora,Jeremy,"Jeremy, she was on the back seat.",Malcolm's 4x4
4,5,Jeremy,Aurora,She must've run off.,Malcolm's 4x4
4,5,Jeremy,Jeremy,"Except she definitely hasn't, 'cause I'm carrying her round in this bag.",Malcolm's 4x4
4,5,Aurora,Jeremy,She never just runs off.,Malcolm's 4x4
4,5,Jeremy,Aurora,"She is a wild animal, you know. The call of the wild? She might've become leader of a pack of foxes or-",Malcolm's 4x4
4,5,Aurora,Jeremy,"Jez, it's Mummy. We're not just leaving her.",Malcolm's 4x4
4,5,Jeremy,Jeremy,"Why did I put her in the bag? I should've thrown her, like a discus.",Malcolm's 4x4
4,5,Aurora,Others,Mummy!,Malcolm's 4x4
4,5,Aurora,Jeremy,"Come on, Jeremy.",Malcolm's 4x4
4,5,Jeremy,Others,Mummy.,Malcolm's 4x4
4,5,Aurora,Others,Mummy!,Malcolm's 4x4
4,5,Jeremy,Others,Mummy.,Malcolm's 4x4
4,5,Aurora,Jeremy,"Oh God, I don't know what I'd do if I lost her.",Malcolm's 4x4
4,5,Jeremy,Jeremy,"Well, you're very close to finding out.",Malcolm's 4x4
4,5,Aurora,Others,Mummy! Mummy!,Malcolm's 4x4
4,5,Jeremy,Others,Mummy!,Malcolm's 4x4
4,5,Mark,Malcolm,"And, in the last quarter at JLB, I personally presided over an increase of close to seventeen percent.",Canal Path
4,5,Lucy,Mark,"Ugh, my mate Carly, again. ""Oh, I'm so sad, I'm gonna take a load of pills. Meh, meh, meh."" Same shit, different day. I'll catch you up.",Canal Path
4,5,Mark,Mark,"Ugh, wealthy, lovely family. If only she wasn't such a horrible person, she'd be the woman of my dreams.",Canal Path
4,5,Malcolm,Mark,"Mark, if anything did happen, how quickly could you up sticks, though? Anything tying you down?",Canal Path
4,5,Mark,Mark,Does a marriage count?,Canal Path
4,5,Mark,Malcolm,"Nope, not that I can think of. Wherever I lay my hat, pending legal searches, that's my home.",Canal Path
4,5,Malcolm,Mark,"Cool. So, you and Lucy seem pretty sweet on each other.",Canal Path
4,5,Mark,Malcolm,"Oh, yeah.",Canal Path
4,5,Malcolm,Mark,What do you think of her? Honestly.,Canal Path
4,5,Mark,Mark,I think she might have a borderline personality disorder.,Canal Path
4,5,Mark,Malcolm,I think she's lovely.,Canal Path
4,5,Malcolm,Mark,"Well, that's nice. I'll tell her that.",Canal Path
4,5,Mark,Malcolm,"OK, great.",Canal Path
4,5,Mark,Mark,"Maybe, instead of marrying Sophie, I should just marry Lucy. No, stop trying to marry everyone, Mark! No need to marry people!",Canal Path
4,5,Sophie,Mark,"Hey, it's Sophie, please leave a message.",Canal Boat
4,5,Mark,Mark,"Answerphone, yes!",Canal Boat
4,5,Mark,Sophie,"Hey Soph, really sorry to have missed you. I'm having a great time on my stag. Bye! Let's speak soon!",Canal Boat
4,5,Mark,Mark,"Although, probably not, because I know when you're busy, and that's when I always ring you.",Canal Boat
4,5,Mark,Jeremy,"Guess what, Jez?",Canal Boat
4,5,Jeremy,Mark,What?,Canal Boat
4,5,Mark,Jeremy,Malcolm's head-hunting for a co-manager of his Indian call centre.,Canal Boat
4,5,Jeremy,Mark,"Right, so?",Canal Boat
4,5,Mark,Jeremy,"There's a chance, a slight but very definite chance, that I could be off to India. And you know what that means. Won't be able to get married.",Canal Boat
4,5,Jeremy,Mark,No?,Canal Boat
4,5,Mark,Jeremy,Of course not! Sophie couldn't ask me to turn down the opportunity of a lifetime.,Canal Boat
4,5,Jeremy,Mark,Couldn't she come?,Canal Boat
4,5,Mark,Jeremy,"Oh, no, there'd be visa issues, endless complications. No, I'm afraid to say, this could put a great deal of strain on the whole relationship.",Canal Boat
4,5,Jeremy,Mark,"Brilliant, well done, mate.",Canal Boat
4,5,Mark,Jeremy,He's nibbling but he hasn't bitten yet. So I'm just gonna get Gerrard to email through my CV and then wow him with a big pitch.,Canal Boat
4,5,Jeremy,Mark,"So, you'd just go?",Canal Boat
4,5,Mark,Jeremy,"Oh, Jez, don't look like that. You could always come. You could start again, find a new career.",Canal Boat
4,5,Jeremy,Mark,I could be your butler.,Canal Boat
4,5,Mark,Jeremy,"That could work. I'd be the Maharaja, you'd be my white concubine.",Canal Boat
4,5,Jeremy,Mark,I could probably live like a king on a tenner a week. I'd do fuck all. Just lie around smoking dope and then maybe have a bit of a go on the washing up before you got home. I'd probably get a record deal just because I've been to Carnaby Street. I'll be the coolest man in India.,Canal Boat
4,5,Mark,Jeremy,And maybe we can get one small servant.,Canal Boat
4,5,Mark,Mark,"We'll need a servant. These leftovers are from two nights ago and he never empties the bin. Oh God, I bet it's bursting at the seams with used condoms and porn.",Canal Boat
4,5,Mark,Jeremy,"Fuck! Ah! There's a... there's a dead beast in our bin, Jeremy!",Canal Boat
4,5,Jeremy,Mark,"All right, keep your voice down.",Canal Boat
4,5,Mark,Jeremy,A dead dog in our bin! How has this happened?,Canal Boat
4,5,Jeremy,Mark,"I don't know, Mark, but there's no point shouting about it.",Canal Boat
4,5,Mark,Jeremy,"Well, why not? Jeremy, is this... Mummy!?",Canal Boat
4,5,Jeremy,Mark,"Look, earlier, in the four by four, I had an accident. I mean, the clutch on that thing!",Canal Boat
4,5,Mark,Jeremy,"Oh, right, brilliant. You've killed Mummy. Well, what the hell is it doing in our bin?!",Canal Boat
4,5,Jeremy,Mark,I had to hid it. Aurora had me looking for it for about four hours. And she made me make posters.,Canal Boat
4,5,Mark,Jeremy,"But, the bin, Jeremy! The bin's for household waste, not beloved pets, et cetera!",Canal Boat
4,5,Jeremy,Mark,"Mark, if I can just get rid of the dog corpse, there's a chance I still might get laid, here.",Canal Boat
4,5,Mark,Jeremy,"Oh, right, this is sort of like a disgusting version of The Great Egg Race.",Canal Boat
4,5,Jeremy,Mark,This doesn't feel great.,Woods
4,5,Mark,Jeremy,"It's not great, Jez, that's why.",Woods
4,5,Jeremy,Mark,"There's no chance of it being traced back to us now, though, 'cause it might've been microchipped.",Woods
4,5,Mark,Jeremy,"Exactly. No, all things considered, my career prospects, your sexual desperation, this is probably the best thing to do.",Woods
4,5,Jeremy,Mark,There's a hell of a lot of steam.,Woods
4,5,Mark,Jeremy,"Yeah, as it turns out, dogs do seem to be mostly water.",Woods
4,5,Jeremy,Mark,"I mean, it's going a bit, just not the legs.",Woods
4,5,Mark,Jeremy,"Well, put the legs back on in the middle, maybe it'll burn better.",Woods
4,5,Jeremy,Mark,"Oh, right! I have to put the legs back on. If you hadn't refused to pay for firelighters, it would've gone by now.",Woods
4,5,Mark,Jeremy,"You shouldn't need firelighters to burn a dog, Jeremy.",Woods
4,5,Jeremy,Mark,"How would you know? Shit, it's going out.",Woods
4,5,Mark,Jeremy,"Look, I've got to get my pitch sorted before I see Malcolm.",Woods
4,5,Jeremy,Mark,"We'll have to bury it, get the spade.",Woods
4,5,Mark,Jeremy,What spade?,Woods
4,5,Jeremy,Mark,You didn't bring a spade?,Woods
4,5,Mark,Jeremy,Do you think I'm some kind of freelance dog-murdering mafia man?,Woods
4,5,Jeremy,Mark,"Oh, great! So we've got no fire, no spade. We'll just have to dig with our hands.",Woods
4,5,Mark,Jeremy,"Jeremy, there are many things I would do to help you, but digging a hole in the wintry earth with my bare hands so that you can bury the corpse of a dog you killed, is not one of them.",Woods
4,5,Jeremy,Jeremy,"I'll just take it to one of those massive council bins. Dump and run, just like my paper boy days. Screw you, Murdoch.",Canal Path
4,5,Aurora,Jeremy,Jeremy.,Canal Path
4,5,Jeremy,Aurora,Hi.,Canal Path
4,5,Aurora,Jeremy,This is my last poster. How did you get on?,Canal Path
4,5,Jeremy,Aurora,"Yep, good, got rid of all of mine, too.",Canal Path
4,5,Jeremy,Jeremy,"Just keep lying till the kissing can start. I mean, it'd have to be a fucking good poster to get that dog back.",Canal Path
4,5,Aurora,Jeremy,I might call it a day and head back to the barge. Coming?,Canal Path
4,5,Jeremy,Aurora,OK.,Canal Path
4,5,Jeremy,Jeremy,"Shit, gotta dump the evidence.",Canal Path
4,5,Aurora,Jeremy,"Jeremy, you've dropped your bag.",Canal Path
4,5,Jeremy,Aurora,"Yeah, so I have. Thanks, honey.",Canal Path
4,5,Jeremy,Jeremy,"Just act normal. I'll tell her what happened, immediately after I've cum.",Canal Path
4,5,Mark,Malcolm,"And, as you can see, I've been in the top ten percentile of performers at JLB for the last three financial years in a row, so...",Malcolm's Barge
4,5,Mark,Mark,"Shit, I'm losing him.",Malcolm's Barge
4,5,Mark,Malcolm,"And, if you look at the bottom, you'll see that my hobbies include history and going to the movies.",Malcolm's Barge
4,5,Lucy,Mark,I like going to the movies.,Malcolm's Barge
4,5,Mark,Mark,"Of course you do, everyone does. Man seeks woman, must be interested in film, breathing oxygen, and converting protein intake into muscle energy.",Malcolm's Barge
4,5,Aurora,Malcolm,Hi guys.,Malcolm's Barge
4,5,Jeremy,Malcolm,"Um, we're interrupting, we should probably-",Malcolm's Barge
4,5,Malcolm,Jeremy,"Sit down, Jez, join the party.",Malcolm's Barge
4,5,Lucy,Aurora,Any luck?,Malcolm's Barge
4,5,Aurora,Lucy,"No, still nothing.",Malcolm's Barge
4,5,Lucy,Malcolm,"Bollocks. OK, Dad, time to turn on the money hose. Up the reward.",Malcolm's Barge
4,5,Mark,Mark,"Fucking hell! He's got Mummy! He's brought a dead dog into my pitch, the stupid bastard!",Malcolm's Barge
4,5,Malcolm,Mark,"Sorry, Mark, carry on, what were you saying?",Malcolm's Barge
4,5,Mark,Malcolm,"Uh, yes, as I was saying, I love cinema, especially the films of Spielberg, Lucas, and the man who did The Usual Suspects.",Malcolm's Barge
4,5,Lucy,Jeremy,What's in the bag?,Malcolm's Barge
4,5,Jeremy,Lucy,"Oh, Mark and I had a barbecue.",Malcolm's Barge
4,5,Aurora,Jeremy,"Oh, barbecue, yum. Have you got any left?",Malcolm's Barge
4,5,Jeremy,Aurora,"No, no, not really, no, we were really hungry.",Malcolm's Barge
4,5,Aurora,Jeremy,"You have got a bit left, I can see.",Malcolm's Barge
4,5,Jeremy,Aurora,"It's really, really badly cooked, we didn't cook it at all well, Mark couldn't be bothered to get firelighters.",Malcolm's Barge
4,5,Mark,Malcolm,"Well, just keeping a handle on the purse strings, there. A-B-C, always be cost-cutting.",Malcolm's Barge
4,5,Malcolm,Mark,Ah-hah.,Malcolm's Barge
4,5,Aurora,Jeremy,"Come on, Jez.",Malcolm's Barge
4,5,Jeremy,Aurora,I really don't think it's a good-,Malcolm's Barge
4,5,Aurora,Jeremy,Oh we've only got cheese and hummus. What is it? It doesn't look very much like-,Malcolm's Barge
4,5,Jeremy,Aurora,It's turkey. It's turkey leg.,Malcolm's Barge
4,5,Malcolm,Jeremy,Is that all right?,Malcolm's Barge
4,5,Jeremy,Malcolm,What can I tell you? I'm no Ainsley Harriott.,Malcolm's Barge
4,5,Aurora,Jeremy,"It looks weird. What's going on, Jeremy?",Malcolm's Barge
4,5,Jeremy,Aurora,"Nothing, it's just turkey, look. You see? Mmm, just under-cooked, disgusting turkey.",Malcolm's Barge
4,5,Jeremy,Mark,Hey Mark! Would you like some?,Malcolm's Barge
4,5,Mark,Jeremy,"No, thanks.",Malcolm's Barge
4,5,Jeremy,Mark,"Here, eat some turkey!",Malcolm's Barge
4,5,Mark,Jeremy,"No, Jeremy, it's not my turkey.",Malcolm's Barge
4,5,Jeremy,Mark,"I really feel, since I'm eating turkey, you should eat some turkey. It was your idea to barbecue it.",Malcolm's Barge
4,5,Mark,Jeremy,"I really don't feel like eating turkey, Jeremy. I'm full.",Malcolm's Barge
4,5,Jeremy,Jeremy,I'm eating dog leg. I have definitely reached a new low.,Malcolm's Barge
4,5,Lucy,Jeremy,What's that on it?,Malcolm's Barge
4,5,Aurora,Jeremy,"Ugh! There's hairs on it, Jeremy!",Malcolm's Barge
4,5,Malcolm,Jeremy,Hairs?,Malcolm's Barge
4,5,Jeremy,Malcolm,It's just a hairy turkey!,Malcolm's Barge
4,5,Aurora,Jeremy,What's this? Mummy?,Malcolm's Barge
4,5,Jeremy,Aurora,Mummy is probably the turkey's nickname! It could easily be.,Malcolm's Barge
4,5,Aurora,Malcolm,They ate Mummy! They burnt Mummy and killed her and ate her!,Malcolm's Barge
4,5,Mark,Malcolm,"Look, I'll email through my references, Malcolm.",Malcolm's Barge
4,5,Jeremy,Aurora,"Aurora, I'll call you.",Malcolm's Barge
4,5,Aurora,Jeremy,"Fuck off, Jeremy!",Malcolm's Barge
4,5,Mark,Mark,Guess not fitting my CV onto one side of A4 is basically irrelevant now.,Malcolm's Barge
4,5,Jeremy,Jeremy,"God, probably good things didn't work out with her, she is totally overreacting. It's not like I ate her mum or her dad.",Malcolm's Barge
4,5,Mark,Jeremy,Did you actually have to eat it?,Malcolm's Barge
