,index,Episode,Speaker,Internal,NumWords,Lines
0,0,1,Jeremy,True,26,"This is fucking wicked. I am almost definitely a musical genius. Maybe a tattoo on my chest, but of my face. Yeah, double me! Feel it!"
1,1,1,Jeremy,False,2,Hey man.
2,2,1,Jeremy,False,21,"I'm telling you, now I know whatshisname felt when he finished the Mona Lisa - knackered. So how was your day?"
3,3,1,Jeremy,False,8,"Well, Toni came round to drop this off."
4,4,1,Jeremy,False,35,"No, she was going to Starbucks to read a book. It's one of her things. Besides, the move, it's not a whole Sophie uptight situation. We're just gradually sliding into a... a fuck buddy scenario."
5,5,1,Jeremy,False,61,"Yeah, a buddy, you can fuck. I mean we're both so relaxed about the whole sex thing. Last time I was around there I watched a porno. Four in the afternoon - just me and her watching a porno. I mean, that's me. I'm not ready for the kind of thing you're after. The whole... someone to go to Waitrose with."
6,6,1,Jeremy,True,14,I wish I was her fuck buddy next door. We could do it through the wall.
7,7,1,Jeremy,False,4,How thick is wall?
8,8,1,Jeremy,True,31,"This Grammy goes out to my homeboys in Compton, the Japanese people who mean so much to me. Hey, Mark's playing my track. Ah, he just can't get enough of that shit."
9,9,1,Jeremy,False,3,What's going on?
10,10,1,Jeremy,False,1,Toni?
11,11,1,Jeremy,False,5,Yes that's right. I'm up.
12,12,1,Jeremy,False,1,Yeah
13,13,1,Jeremy,False,1,Yeah
14,14,1,Jeremy,False,16,Sure. It was Dr Ying Fu Yip... Wang Shong Pang... Fang Wang Dang Dong Ning Po Ku.
15,15,1,Jeremy,False,2,Super Hans!
16,16,1,Jeremy,False,5,No logo on the foam?
17,17,1,Jeremy,False,12,"No, I've been thinking, I'm not sure. I think maybe it's shit."
18,18,1,Jeremy,False,8,It's just I found Mark laughing at it.
19,19,1,Jeremy,False,9,"Plus, he was doing it in front of Toni."
20,20,1,Jeremy,False,2,You think?
21,21,1,Jeremy,False,11,Do you think that's why we haven't got a deal yet?
22,22,1,Jeremy,False,1,Yeah?
23,23,1,Jeremy,False,1,Right.
24,24,1,Jeremy,False,8,What's the matter? I thought you liked pork.
25,25,1,Jeremy,False,6,It means omertà. It means rewengay.
26,26,1,Jeremy,False,23,"Don't think I can't see you Mark, trying to get a slice of my action because Sophie the office girl won't put out."
27,27,1,Jeremy,False,18,"Well let's have some more truth shall we? Yeah, yeah? Cause the truth is, you're a posh spaz!"
28,28,1,Jeremy,False,16,In the way you're always doing posh spazzy things like tidying up and ironing your socks.
29,29,1,Jeremy,False,3,"Socks, shirts, whatever!"
30,30,1,Jeremy,False,11,"Oh, I get it. Are you going to do me in?"
31,31,1,Jeremy,False,16,Are you going to punch me Mark? Is that it? Is that what's going to happen?
32,32,1,Jeremy,False,34,"You're an animal, Corrigan. You have to keep your tie done up to eleven otherwise all this grey, ugly, office envy sludge will just spill out and drown you! And you've got weird nuts!"
33,33,1,Jeremy,False,19,"If you're going to watch the TV in your dressing gown, you might want to put some pants on."
34,34,1,Jeremy,False,2,Me too.
35,35,1,Jeremy,False,7,Me too. That's exactly how I feel.
36,36,1,Jeremy,False,7,"So, Toni's friends. Who, what, why, where?"
37,37,1,Jeremy,False,1,Wicked.
38,38,1,Jeremy,True,16,"If I laugh at everything she says, I'm bound to at least get a suck job."
39,39,1,Jeremy,False,8,I know but it looks just like a fried egg.
40,40,1,Jeremy,False,2,"Right, nightmare."
41,41,1,Jeremy,True,45,"Jesus, how did I get trapped with her? She's definitely the most boring person here. I mean they look great, they're probably talking about how they're going to make a real life porn movie with a proper story and everything. I could do the music."
42,42,1,Jeremy,False,8,So where do you live in the building?
43,43,1,Jeremy,False,7,"Oh, OK, and what do you do?"
44,44,1,Jeremy,False,9,You do? Well that's amazing! That's just really amazing!
45,45,1,Jeremy,True,11,"Heh-heh, yeah this is it. Paula's gonna love this. Very Iggy."
46,46,1,Jeremy,False,8,"Oh well, could I do mine again then?"
47,47,1,Jeremy,False,15,"Don't even go there, it is literally impossible. Turns out I was just someone's secretary!"
48,48,1,Jeremy,False,8,"Yeah, right whatever. We're just popping next door."
49,49,1,Jeremy,False,25,"That's right, yeah. I'm taking Paula back to listen to my work. She seems like someone who'd appreciate a good track when she heard it."
50,50,1,Jeremy,False,26,"Yes, that's right, I'm going. The coast is clear. I don't expect you'll get very far but by all means have a pop at the champ."
51,51,1,Jeremy,False,4,What? Are you serious?
52,52,1,Jeremy,False,2,"No, right."
53,53,1,Jeremy,False,5,"Look, you're a cockmuncher, OK?"
54,54,1,Jeremy,True,14,"Of course, you can't catch cancer. I mean, I'd have heard. Someone would've said."
55,55,1,Jeremy,False,5,Do you really think so?
56,56,1,Jeremy,True,6,What kind? Blood? Bone? Knee? Face?
57,57,1,Jeremy,False,5,Great! I mean... that's great!
58,58,1,Jeremy,True,5,"Shit. Of course, it's who you blow."
59,59,1,Jeremy,False,13,"No, no, sure. I know the rules. Yeah. Let's get it on, baby."
60,60,1,Jeremy,True,9,"You're a sunshine coach, bringing a last smile to…"
61,61,1,Jeremy,False,17,"Urgh, if we've got to do this, do you mind keeping the hat on? It's just... sorry."
62,62,1,Jeremy,False,1,No?
63,63,1,Jeremy,False,36,"I don't mind. I'd just rather not. We could take Polaroids of me, you know, all excited and you could take them away or something. I am very keen to sort you out, so to speak."
64,64,1,Jeremy,False,9,"But on the song, do you really like it?"
65,65,1,Jeremy,False,12,"Yeah, I guess you're not in the right frame of mind to..."
66,66,1,Jeremy,True,6,"Don't go on about it, Jesus."
67,67,1,Jeremy,True,6,How much time has she got?
68,68,1,Jeremy,False,13,"Maybe. I mean, how long are you planning to stay in your job?"
69,69,1,Jeremy,False,7,"Right. Look, should you be doing that?"
70,70,1,Jeremy,False,15,"Jesus. You know, I do think you're brave. I just think you're very, very brave."
71,71,1,Jeremy,False,11,"Listen to you, you beautiful crazy thing. I meant... the cancer."
72,72,1,Jeremy,False,6,The bloody cancer eating you away!
73,73,1,Jeremy,False,15,Oh yeah! Very funny! I suppose you think cancer is this huge enormous practical joke!
74,74,1,Jeremy,False,35,"No, no you're quite the guy. Certainly not the kind of sicko to ruin someone's music career by suggesting that certain other people have cancer! What joke is next? Hey Jez, your mum's dead! Ba-boom! Bloody hilarious!"
75,75,1,Jeremy,False,23,I'm sure if Kerry was here she'd be rolling round the floor except she couldn't cause she's head to toe in acupuncture needles.
76,76,1,Jeremy,False,35,What's the big deal? So I didn't give him the number for Dr Tang. She's got leukaemia. Sticking a few needles in her face at fifty quid a pop is not going to fix that.
77,77,2,Jeremy,True,12,"Yeah, take that, big Suze. Your toilet-seat regime is over. Ah, freedom."
78,78,2,Jeremy,True,3,There he is.
79,79,2,Jeremy,False,3,"Good morning, Mark."
80,80,2,Jeremy,True,6,"Wedge of ballast, then bed again."
81,81,2,Jeremy,True,40,It's a bit like the crusher in Star Wars but red hot. What if Mum and Dad were trapped in one and I had a big hook I could swing down to rescue one of them. Who would I pick?
82,82,2,Jeremy,False,1,Uh-huh.
83,83,2,Jeremy,True,28,"Clerical assistant? I can't be a clerical assistant. I'm a musician. You wouldn't ask the Chemical Brothers to do your laundry for you, they'd be off their tits."
84,84,2,Jeremy,False,9,"Tomorrow at eleven. Yeah, sure. I'll set the video."
85,85,2,Jeremy,False,11,"Mm-hmm, it's just the music, it's really starting to hot up."
86,86,2,Jeremy,False,34,"Super Hans said he's come up with a bass loop for our new track that is so good that when he tried turning it off, he literally couldn't. He actually physically couldn't do it."
87,87,2,Jeremy,False,3,Oh. The rent.
88,88,2,Jeremy,False,10,"Don't worry, you'll get your milk. This track's a banker."
89,89,2,Jeremy,False,5,Everybody needs their Somethin' Stupid.
90,90,2,Jeremy,False,18,"The guy who wrote that, he's probably up to his neck in penny loafers and blue pool tables."
91,91,2,Jeremy,False,5,"Blimey, what's God up to?"
92,92,2,Jeremy,False,1,Mmm.
93,93,2,Jeremy,False,7,"Uh yeah, cool. Have a good one."
94,94,2,Jeremy,False,2,"Bye, mate."
95,95,2,Jeremy,True,15,"Tight-fisted cock-muncher. Maybe next time I have breakfast, he'll make me sit a fucking exam."
96,96,2,Jeremy,True,24,Super Hans said he'll be here in twenty minutes. Means I've got at least an hour. I bet Mark's got some porn here somewhere.
97,97,2,Jeremy,True,60,"Mark's got no conception. He thinks I'm so... but really I'm busting my creative balls here, day in, day out. No, but it's all, ""Where's the money? Where's my rent?"" I mean where's the rent, Mr. Jim Morrison? Mr. Keats? No, you don't like the attack dog, do you, Mr. Keats? Hold on I think I've struck the mother lode!"
98,98,2,Jeremy,True,9,Fantasy Figure Modeller. Jesus. Maybe this is his porn.
99,99,2,Jeremy,True,55,"I'm a dirty hobbit and she's a sexy elf so she might be ""Ohh! You dirty hobbit. Take off my bodkin and my jerkin."" Oh, yeah, pixie ears. But that sword. What if she was a hobbit slayer? I'd just use my enchanted amulet. Yeah. Yield to me, hobbit-slayer. You will touch my magic cock."
100,100,2,Jeremy,False,2,I dunno.
101,101,2,Jeremy,False,6,It's just... I don't like it.
102,102,2,Jeremy,False,3,I just don't.
103,103,2,Jeremy,False,8,"Uh, we are not the Hair Blair Bunch."
104,104,2,Jeremy,False,7,This is the end of Mama's Kumquat.
105,105,2,Jeremy,False,19,"Look, if this is it, if this is John and Paul 1970, then I need money, for the equipment."
106,106,2,Jeremy,False,8,"Look I'm just saying I need money, and…"
107,107,2,Jeremy,False,7,We are not the Hair Blair Bunch!
108,108,2,Jeremy,True,34,"Yeah, perfect plan. I want to fax this off then oh, Toni, I feel incredibly tired. Let's just both lie down on your bed. Hope she gets out the bong, not the fucking cafetiere."
109,109,2,Jeremy,False,23,"Yeah so I was wondering. You're an urban, switched-on kind of lady. You've probably got a fax machine and all that stuff, right?"
110,110,2,Jeremy,False,10,Yeah. No I was just got this crappy job application.
111,111,2,Jeremy,False,7,What? Has Mark been talking to you?
112,112,2,Jeremy,False,4,I don't think so.
113,113,2,Jeremy,False,9,"Well, you're kind of making me say that, but—-"
114,114,2,Jeremy,False,5,Right. Good. What's pyramid selling?
115,115,2,Jeremy,False,18,"And it's like a big, lovely club with free money for everyone? I mean it sounds great, but…"
116,116,2,Jeremy,False,1,Right.
117,117,2,Jeremy,False,5,I bet he did it.
118,118,2,Jeremy,False,13,"No, I mean, not because- he was at the garage at the beginning!"
119,119,2,Jeremy,False,13,We already know he's the only one with the key to the lock-up.
120,120,2,Jeremy,False,4,"Well, maybe you should."
121,121,2,Jeremy,False,6,"All right, let God decide. Ready?"
122,122,2,Jeremy,False,17,"Ah, you see! He did do it, but for a nice reason. Who's the racist now, Mark?"
123,123,2,Jeremy,False,2,"Oh, fuck!"
124,124,2,Jeremy,False,1,Jesus!
125,125,2,Jeremy,False,4,Maybe it was charming.
126,126,2,Jeremy,False,30,"No, not an oddball. A maverick. You may not play by the rules, but by Christ, you get results. Come on, let's go and have a drink, forget about it."
127,127,2,Jeremy,False,8,Have you forgotten about the phone call yet?
128,128,2,Jeremy,False,17,"Right. Tell me Mark, how much washing-up do you think you could do without any washing-up liquid?"
129,129,2,Jeremy,False,10,Exactly. And what about our friends and neighbours and colleagues?
130,130,2,Jeremy,False,16,"I mean everyone needs cleaning products and that's the one thing that's never gonna change, right?"
131,131,2,Jeremy,False,20,"Well, that's a very interesting question. Now, the first thing to say would be that this is not pyramid selling."
132,132,2,Jeremy,False,5,"No no, not pyramid selling."
133,133,2,Jeremy,False,19,"Listen, listen, it's not pyramid selling, it's network marketing and it's a guaranteed money-making. Mark I've seen the, the charts."
134,134,2,Jeremy,False,8,Are you trying to piss on my bonfire?
135,135,2,Jeremy,False,15,"I'm not about to piss all over myself. I'm, I'm pissing into the big time."
136,136,2,Jeremy,False,3,"Well, I thought…"
137,137,2,Jeremy,False,7,Yeah but if you get in early…
138,138,2,Jeremy,False,1,OK.
139,139,2,Jeremy,True,17,"Oh I'll come to the interview, all right, but I don't think I'll be getting the job."
140,140,2,Jeremy,False,1,Huh-huh.
141,141,2,Jeremy,False,7,"Uh, nothing, just something funny. Can you...?"
142,142,2,Jeremy,True,11,"OK, here we go. Operation 'Come Over Like an Unemployable Freak'."
143,143,2,Jeremy,False,38,"Right you are. I might wobble because I'm still a bit pissed from last night you see, and I don't want to get your hopes up 'cause I have to say, I'm only really here because, you know…"
144,144,2,Jeremy,False,1,Mark.
145,145,2,Jeremy,True,2,"Oh, shit."
146,146,2,Jeremy,True,19,"Got to be really careful. Don't want to get the job, don't want to piss off the land baron."
147,147,2,Jeremy,True,12,"Shit, what's she talking about? Nod. Look serious. I'm Di, she's Bashir."
148,148,2,Jeremy,False,39,"Er, I've done quite a lot, actually. I mean, not formal filing but alphabeti-ba-cising the videos, doing the spices. I suppose what I'd want to do is build on that experience in a professional zone. Sphere. I meant sphere."
149,149,2,Jeremy,True,9,"God, that sounded amazing! Don't accidentally get the bugger."
150,150,2,Jeremy,False,13,"Yeah, I suppose it would, actually. Although I'm looking for something more relaxing."
151,151,2,Jeremy,False,21,"No, challenging is right, um, but a bit more of a relaxing challenge. More like doing a crossword than a tracheotomy."
152,152,2,Jeremy,True,13,"Oh, shit. My natural bloody charm's only swinging it. Got to do something."
153,153,2,Jeremy,False,6,It's just a thing I have.
154,154,2,Jeremy,False,3,"I do, sometimes."
155,155,2,Jeremy,False,19,"Yes, Barbara. Yes, there is. Barbara, how much washing-up do you think you could do without any washing-up liquid?"
156,156,2,Jeremy,False,5,It's a unique business opportunity.
157,157,2,Jeremy,False,5,"It's not pyramid selling, Mark."
158,158,2,Jeremy,False,5,You're pissing on my bonfire!
159,159,2,Jeremy,False,6,Because you keep pissing on it!
160,160,2,Jeremy,False,10,"Yeah, well, at least I don't fancy elves and pixies."
161,161,3,Jeremy,False,1,Mark!
162,162,3,Jeremy,False,11,You do realize tinned food is just for crackheads and wars.
163,163,3,Jeremy,False,36,"Yeah, it's first pressing, or do you want to wait until everyone else has had their fun with the olives? Fourth pressing, yeah, like that's going to be a party in your mouth. I don't think."
164,164,3,Jeremy,False,19,Mark! I'm not shopping. I just came here to tell you we've been invited to a very wicked party.
165,165,3,Jeremy,False,43,"I did actually but she said no. But it's better this way, two lads, we gotta get out there, grooving, doing it, you know? It's been a long time for either of us. I haven't had my oats in something like, two weeks!"
166,166,3,Jeremy,True,5,Nine months and thirteen days.
167,167,3,Jeremy,False,14,I mean look at us! People are gonna think we spend the whole day wanking.
168,168,3,Jeremy,False,11,"Yeah, man mess. Why do you think they're called ""man size?"""
169,169,3,Jeremy,False,8,"Oh Mark, come on man, let it go."
170,170,3,Jeremy,False,20,Yeah but what if you want to get Sophie back home? You might want to get her all lathered up.
171,171,3,Jeremy,False,3,Shit. Did you?
172,172,3,Jeremy,False,2,And she?
173,173,3,Jeremy,False,25,"Oh man I'm... but listen, this is the perfect time to get back in the game. You know, two guys, together, out, looking for... it."
174,174,3,Jeremy,False,22,"It's eight o'clock on a Friday night. Most people aren't doing their shopping now, yeah? Most people are out right now, yeah?"
175,175,3,Jeremy,False,5,"So, safe party. Super safe!"
176,176,3,Jeremy,True,18,"OK, OK, playing it cool? All right, how about I go a little Oscar Wilde on your ass?"
177,177,3,Jeremy,False,23,"So I always go for the first pressing. I mean why wait until everyone else has had their fun with the olives, right?"
178,178,3,Jeremy,True,15,What's her problem? This is the 21st Century. Olive oil is a perfectly acceptable topic.
179,179,3,Jeremy,True,58,"This is great. Knew this would pay off. Talking's bullshit. ""Yeah, I did this"", ""I go there"". OK, there's a new guy in town. Probably just a friend. Yeah, me, her and her friend. Quite nice actually. Hey! That's a foul. Fuck! God, she must be loving this. I feel so cheap. I really thought we had something."
180,180,3,Jeremy,True,14,I can't believe she's snogging him already. The dream is over. I am detritus.
181,181,3,Jeremy,False,5,We're going to the Lazerbowl?
182,182,3,Jeremy,False,9,"Me, you and Valerie are going to the Lazerbowl?"
183,183,3,Jeremy,False,6,Maybe... I could bring someone along?
184,184,3,Jeremy,False,41,"I know, I'll call Toni. Yeah, no, this is perfect cause I'll just say ""Me, Mark and Valerie are off down the Lazerbowl. Do you want a piece of the action?"" and she'll be like ""Hell yeah! Why the hell not?"""
185,185,3,Jeremy,False,8,"This is mate, we're having it. Super nice!"
186,186,3,Jeremy,False,7,"Do you? Follow the finger, follow the fingers!"
187,187,3,Jeremy,False,4,Are you getting visuals?
188,188,3,Jeremy,False,31,"No of course no. Look, everything's going brilliantly, right? Now we've got to work together as a team. Work things up into a bit of a lather, yeah? Follow my lead."
189,189,3,Jeremy,True,12,"I could say we've both got enormous cocks, might be the clincher."
190,190,3,Jeremy,False,5,This is great! Isn't it?
191,191,3,Jeremy,False,11,"Great. So, girls, what's the weirdest place you've ever... done it?"
192,192,3,Jeremy,False,6,"Yeah, right. Valerie, how about you?"
193,193,3,Jeremy,False,6,"OK, so, what's everyone's favourite record?"
194,194,3,Jeremy,True,25,"This should be in the bag. She's come to the Lazerbowl with me, why isn't this in the bag? She looks like she hates me."
195,195,3,Jeremy,False,10,"What? It's eat as much as you can, you know."
196,196,3,Jeremy,False,6,"At £3.99, I know who's winning."
197,197,3,Jeremy,True,8,"Oh God, please stop talking about Peter Gabriel!"
198,198,3,Jeremy,False,1,Uh-huh
199,199,3,Jeremy,True,32,Maybe I can just really get into Peter Gabriel and go mental and marry her and cut off from society and just have lots of sex and agree with her about everything.
200,200,3,Jeremy,True,16,"Come on, clock's ticking. Got to raise my game. Think witty. Charming and witty. And sexy."
201,201,3,Jeremy,False,21,"So, fourth pressing, fifth pressing. What's that all about? Why wait until everyone else has had their fun with the olives?"
202,202,3,Jeremy,True,10,"Oh my God, I knew it. Olive oil talk. Wicked!"
203,203,3,Jeremy,True,40,"Wow, fuck you Lord of Death. I'm still full of piss and vinegar. Mmm, doing it with a sexy neighbour. Ow! That... why is she sucking it? Maybe she's practising for my... are you allowed to say when it hurts?"
204,204,3,Jeremy,False,1,Oh SHIT!
205,205,3,Jeremy,True,11,Maybe this is good? Maybe this kind of turns me on?
206,206,3,Jeremy,False,4,I think maybe I'll…
207,207,3,Jeremy,False,2,"Er, OK."
208,208,3,Jeremy,True,19,"This is some sort of test. Sort of like The Great Escape. Don't answer in English, just brave it out."
209,209,3,Jeremy,False,5,"Yeah, I play the keyboard."
210,210,3,Jeremy,True,16,They're going to use me for a sex game and then burn me in the bath.
211,211,3,Jeremy,False,2,To us.
212,212,3,Jeremy,True,13,"Oh, come on. Someone get the carving knife and get it over with."
213,213,3,Jeremy,True,13,Is she going for...? But I'm not ready. There's no action down there!
214,214,3,Jeremy,False,12,"Look, are you sure this is OK? Isn't Tony going to mind?"
215,215,3,Jeremy,False,9,"Oh my God, oh my God, oh my God!"
216,216,3,Jeremy,False,2,Oh God!
217,217,3,Jeremy,False,5,Couldn't we close the door?
218,218,3,Jeremy,False,5,But we've already been caught.
219,219,4,Jeremy,False,6,"Super Hans, what are we doing?"
220,220,4,Jeremy,False,9,I don't feel very well. Did something bad happen?
221,221,4,Jeremy,False,4,Did I break through?
222,222,4,Jeremy,False,6,"But, what was the bad thing?"
223,223,4,Jeremy,True,6,Floss is boss! Floss is boss!
224,224,4,Jeremy,False,3,FLOSS IS BOSS!
225,225,4,Jeremy,True,5,"No, not that. Something worse."
226,226,4,Jeremy,False,2,What happened?
227,227,4,Jeremy,False,7,I think we need to tidy up.
228,228,4,Jeremy,True,99,"God, I feel like loam, a piece of loam. Jesus, what am I talking about? I wish Mark was here. No more drugs. I don't need drugs. I mean what great music was ever made on drugs? Bowie, obviously, The Floyd, The Prodge, Aphex - the list is endless really, but they could be done twice as fast with half the mess if they just... Ahh, was that the bad thing? Not that. Something wrong-er. Heh, Mark will be so pleased when he sees this, he's just so- Maybe I could open my bank statements. Maybe you can be boring and cool."
229,229,4,Jeremy,False,9,"Hey, you're back! This is great. You're really back!"
230,230,4,Jeremy,False,10,The El Dude Brothers are back in town! Ehhhh! Ehhhh!
231,231,4,Jeremy,False,28,"Come on in, sit down. Tell me all about your trip. I want to hear everything, all the gory details. Did you bring back any little tiny soaps?"
232,232,4,Jeremy,False,6,Course I am. Now you're back.
233,233,4,Jeremy,False,11,Wine? Friend? But you haven't got a friend. Who's you're friend?
234,234,4,Jeremy,True,28,"This is good, yeah. I mean three guys sitting around shooting the shit. Politics doesn't have to be boring. A lot of Moby stuff is political... I think?"
235,235,4,Jeremy,False,26,"Yeah, it's all lies, isn't it? I mean don't tell me Blair wears a suit and tie when he's lounging around at home watching Big Brother."
236,236,4,Jeremy,False,51,"What I mean is that they should be more honest. I mean, at least Tony Adams from the IRA, he's like ""Yeah, I shoot people. I like shooting people."" You know, if they were more honest, then maybe people would vote and not switch straight over when the news comes on."
237,237,4,Jeremy,False,31,"No! No, sometimes. Maybe for a treat. But generally it's great, isn't it? Who do you support? Mark likes Israel, I'm Palestine. Makes it more interesting when you pick a... no?"
238,238,4,Jeremy,True,10,Oh my God! The bad thing! That's the bad thing!
239,239,4,Jeremy,False,2,Mega tsunami!
240,240,4,Jeremy,False,5,Can I have a look?
241,241,4,Jeremy,False,10,Oh! Oh dear! Look what you've... is it all right?
242,242,4,Jeremy,False,25,Yes it was. It was working fine and then you spilled your drink on it and it broke. That's what happened. That's what I saw.
243,243,4,Jeremy,False,1,Hey.
244,244,4,Jeremy,True,17,This could be good. Just like the old days. Play it cool. Don't slag off Johnson... yet.
245,245,4,Jeremy,False,16,"Oh! Johnson says! Johnson says! If you love Johnson that much, why don't you marry him?"
246,246,4,Jeremy,False,18,"Why don't you actually screw him? I mean, since you clearly want to do that, why don't you?"
247,247,4,Jeremy,False,21,"Oh, just because he's black, I have to like him. Do I? That's political correctness gone mad! Look, Mark, I'm sorry..."
248,248,4,Jeremy,False,2,You're kidding.
249,249,4,Jeremy,False,9,"OK, OK. That's fine. I'm fine with that. Good."
250,250,4,Jeremy,True,8,"If I keep smiling, maybe he won't leave."
251,251,4,Jeremy,False,18,"Actually, this is a pretty cool place, isn't it? Chopsticks. Hmm? These are bit long for me, actually."
252,252,4,Jeremy,False,10,"That's better. So, tell me all about the wasabi sauce."
253,253,4,Jeremy,False,1,Yeah?
254,254,4,Jeremy,False,13,"Um, I don't know. Maybe a few weeks. I mean nothing's really decided yet."
255,255,4,Jeremy,False,8,"Yeah, or maybe get him a nice watch?"
256,256,4,Jeremy,True,22,This could be all right. I'll just get Mark to make us a cleaning rota. We'll just stick religiously to the rota.
257,257,4,Jeremy,False,14,"Do you think he really wondered, Sting? If the Russians loved their children too?"
258,258,4,Jeremy,False,23,"I'm not sure. He really seems to be sincerely hoping the Russians love their children too, which I think is a little patronising."
259,259,4,Jeremy,False,4,I could drive you.
260,260,4,Jeremy,False,7,"Well, he gave you the keys Mark."
261,261,4,Jeremy,False,24,"It's probably some kind of initiative test, you know ""Will you walk like some kind of stupid duck or will you drive like Clarkson?"""
262,262,4,Jeremy,False,39,"Oh, right! Suddenly something's going to happen. Suddenly I'm going to drive off the non-existent quayside. Listen, I'm insured on my mum's insurance to drive any car. It's freezing out there, Johnson won't mind... if he's a real mate."
263,263,4,Jeremy,False,1,Yes.
264,264,4,Jeremy,True,1,Probably.
265,265,4,Jeremy,True,10,"Who's the Johnson now, huh? Who's the Johnson now, Johnson?"
266,266,4,Jeremy,False,7,Shall we open her up a bit?
267,267,4,Jeremy,False,11,"If it feels good, do it. Isn't that Johnson's whole philosophy?"
268,268,4,Jeremy,False,6,"Ha, haha. They love it really."
269,269,4,Jeremy,False,26,Well what do you two do in the car then? Don't tell me you just sit around and talk about what the VAT is on cigarillos?
270,270,4,Jeremy,False,5,"Hey, I've got an idea."
271,271,4,Jeremy,False,4,This is so right.
272,272,4,Jeremy,False,13,Yes you can. All you have to do is believe. Driving is bullshit.
273,273,4,Jeremy,False,17,"Now just very very slowly take your foot off the clutch and just tickle the accelerator, OK?"
