,index,Episode,Speaker,Internal,NumWords,Lines
803,803,4,Mark,False,12,"Johnson told me about it. Apparently, according to Johnson, wasabi sauce is…"
804,804,4,Mark,False,9,Where did this come from all of a sudden?
805,805,4,Mark,False,27,"Jeremy! Look, I've got nothing against... being gay, but I'm not and neither is Johnson. He's black, in case you hadn't noticed, which I expect you had."
806,806,4,Mark,True,17,Jesus! I'm probably just the sort of person who'd be gay and repress it even to himself.
807,807,4,Mark,False,35,"The thing is, well, there's no easy way to put this but Johnson's invited me in with him. He wants me to get into bed, team up with him. It would mean relocating to Cardiff."
808,808,4,Mark,False,49,"Look, I really feel I need to go for this, Jez. Look, it not as if it's the end for us. We're still the El Dude Brothers. We'll always be the El Dude Brothers. It's just that... I'm leaving. I can't spend my life with you at base camp."
809,809,4,Mark,True,9,He's cracked. I hope he doesn't do anything drastic.
810,810,4,Mark,True,22,"If he hangs himself over this, I could put an orange in his mouth and say it was a fatal wanking accident."
811,811,4,Mark,False,19,"I'm so glad you came here for a follow-up, man. You totally blew apart Barbara's stone age business paradigm."
812,812,4,Mark,True,25,"Maybe I do fancy him? He's handsome, not in a gay way, it's just obvious. He's a good-looking guy. A guy's guy. But would I?"
813,813,4,Mark,False,9,"Sophie! Sophie, Sophie, Sophie! You know Alan, of course."
814,814,4,Mark,False,12,"You've got to admit, Soph, she was asking a lot of questions."
815,815,4,Mark,False,2,See you.
816,816,4,Mark,True,31,"I do want to be with him all the time... but could I think about kissing? Well I'm thinking about it. No I'm not, I'm just thinking about thinking about it."
817,817,4,Mark,False,15,"Yeah, she's very... yeah, I could have a little thing going there with Sophie, actually."
818,818,4,Mark,False,1,Yeah?
819,819,4,Mark,False,1,Er...
820,820,4,Mark,False,6,She's... I think she's very pretty.
821,821,4,Mark,False,12,"Well she's... Maybe it is a bit... nice, but in a sense..."
822,822,4,Mark,True,7,"Oh yes! Take me Johnson, I'm yours!"
823,823,4,Mark,True,41,"There's probably much less to worry about with gay sex. I mean you know where you are with a cock. Still, even if I am gay, Johnson isn't. I mean it's going to be hard enough turning me gay, let alone…"
824,824,4,Mark,True,5,"OK, listen to the Johnson."
825,825,4,Mark,False,1,Heh.
826,826,4,Mark,True,3,"Yes, take that!"
827,827,4,Mark,False,3,"Oh, you know."
828,828,4,Mark,True,3,"Stay strong, brother."
829,829,4,Mark,False,4,"Didn't faze me, sweetheart."
830,830,4,Mark,True,7,That was probably a bit too much.
831,831,4,Mark,False,2,Yeah whatever.
832,832,4,Mark,True,6,"That's all very possible, totally possible."
833,833,4,Mark,True,2,Don't weaken.
834,834,4,Mark,False,3,"No, no, why?"
835,835,4,Mark,True,13,"This is ridiculous. She's beautiful, I'm not gay, forget Johnson! Go for it!"
836,836,4,Mark,False,8,"Fine, no it's fine. Just nothing, a bump."
837,837,4,Mark,True,14,"It's staring you in the face, Mark. There's only one other sex to try."
838,838,4,Mark,True,132,"Good old unfriendly Mr Patel. Never says a word... whether you're buying cornflakes, fabric softener, or gay porn. So here we go, watch without prejudice. I'm just testing the water. I'm a sexual scientist. So I'm keeping in trim. This is fine. Typical evening in, Johnson's doing the spreadsheet. There's nothing to be afraid of. It was very popular with the Romans and they got a lot done. How's it going Johnson? Haha, so quick. Yeah, some good kissing. Maybe I'm just bi-curious? What if that was actually Johnson, would that make me hotter? What about if he had Sophie's face? Or Sophie body with Johnson's face. Mum, dad, I'm bi-curious. Yeah right, the bum. Nothing wrong with the bum. Ah! That's a bit too rich for me! I just don't know!"
839,839,4,Mark,False,19,"No, it's a rhetorical question, you know, like ""Can you feel The Force?"" or ""Do they know it's Christmas?"""
840,840,4,Mark,False,16,I really need to pick up my laptop from the IT guy before Johnson gets here.
841,841,4,Mark,False,1,What?
842,842,4,Mark,False,26,"No, he forgot the keys after the pub and then he called to put me in charge of the keys until such a time he reclaims the keys."
843,843,4,Mark,False,4,What if something happened?
844,844,4,Mark,False,5,You're insured on any car?
845,845,4,Mark,False,10,"No, absolutely not! We're almost at the office now and…"
846,846,4,Mark,False,1,No.
847,847,4,Mark,False,14,"God, Jeremy, no! God! That was Mica from... I hope they didn't recognise me!"
848,848,4,Mark,False,10,Of course not! Sometimes he lets me do the gears.
849,849,4,Mark,False,4,This doesn't feel right.
850,850,4,Mark,False,4,But I can't drive.
851,851,4,Mark,False,3,Oh. My. God.
852,852,4,Mark,False,14,"OK. OK, OK! Look at me go! I'm driving! Look at me driving, Jez!"
853,853,4,Mark,False,14,"Yeah, oh yeah, come on! I'm driving. I'm Johnson. Driving is bullshit! I'm Johnson!"
854,854,4,Mark,False,6,Right is bollocks. I'm going rogue.
855,855,4,Mark,False,6,"Jesus. Yeah, h-how do I er…"
856,856,4,Mark,False,5,How do I do stopping?
857,857,4,Mark,False,4,What? This old banger?
858,858,4,Mark,False,19,"Yeah, and you'd probably like a spin, but we're just tooling around town. You know, it's a guy thing."
859,859,4,Mark,False,3,"It's cool, Jez."
860,860,4,Mark,False,5,"See you around, Soph. Oh, Jesus."
861,861,4,Mark,False,7,You've got to help me out here.
862,862,4,Mark,False,26,"Look, Jez, you've got to take the rap. I mean, you don't have to but... I have a future whereas you... not don't, just, it's different!"
863,863,4,Mark,False,2,True mates.
864,864,4,Mark,False,11,Uhhh! Johnson is here! Johnson is here! You're such a good guy.
865,865,4,Mark,True,13,"We'll be in Cardiff together within the fortnight. Relax, Mark. Business before pleasure."
866,866,4,Mark,False,8,"Alan, come in. I'm afraid something terrible has happened."
867,867,4,Mark,False,10,"I mean, he says ""borrowed"", but really I had no..."
868,868,4,Mark,False,4,"Jeremy, for God's sake!"
869,869,4,Mark,False,67,"Love you?! Of course not! No! Yes yes, maybe a bit. I do possibly, somewhat. But Alan, it's not how it seems. I'm 85% sure I'm straight. It's just I do have feelings for you and, in principle, I'm not against more... it's just, I don't think I'll know till it's right there in front of me, whether I'll be able to go through with it, OK?"
870,870,4,Mark,False,6,I just don't know any more!
871,871,4,Mark,True,16,"Not this. I don't want this. Not now. I'm not gay. Possibly bi, but basically uncurious."
872,872,5,Mark,True,34,"If I get promoted to loan supervisor, that's an extra 160 a month. Four months - weekend in Zurich. If I get it. I should've ironed my... why didn't I iron my fucking tie?!"
873,873,5,Mark,False,8,Nope. Not out yet. Haven't been in yet.
874,874,5,Mark,True,3,Lovely soft face.
875,875,5,Mark,False,21,You're right. Totally right. A laugh. Have a nice laugh. Do you think Jeff's charity squash stuff's gonna count for much?
876,876,5,Mark,True,1,Oohhh...
877,877,5,Mark,False,7,"Sophie, have you ever been to Zurich?"
878,878,5,Mark,True,4,Too much! Too much!
879,879,5,Mark,False,15,"Very clean, apparently. Ruthlessly clean. Talking of which, badminton round-robin. You still on for Wednesday?"
880,880,5,Mark,False,5,"And I was thinking, afterwards…"
881,881,5,Mark,True,16,"Forget it mate, you're dead in the water. I'm going to be relaxing all over you."
882,882,5,Mark,True,48,The interview went really well. Glad I didn't mention the phones. Keep the big idea on ice for now. Maybe I should've mentioned the blind kids. Although I could've sounded like I just did it for my CV. I definitely did not do that just for my CV.
883,883,5,Mark,False,2,Hey Sophie!
884,884,5,Mark,False,7,What's... they didn't give it to Jeff?
885,885,5,Mark,False,1,YES!!
886,886,5,Mark,False,7,Is this... is this a funny joke?
887,887,5,Mark,False,13,"Well good, that's really good. Great, well I'll just get on with these."
888,888,5,Mark,False,14,It doesn't matter! It doesn't matter! So what happened? Congratulations. What the hell happened?
889,889,5,Mark,False,12,"Sure, sure. What's the real deal? What's the story behind the story?"
890,890,5,Mark,False,28,"No, I mean you know, you know how I think of you but, you've got to say I'm the better loan manager. Right? You've got to say that."
891,891,5,Mark,False,7,"You've got to say that, haven't you?"
892,892,5,Mark,False,3,"Well, thanks boss."
893,893,5,Mark,False,2,"Yeah, right."
894,894,5,Mark,False,2,You're serious?
895,895,5,Mark,False,10,"No, totally. That's fine. Fine. Yep, I'll do that. Fine."
896,896,5,Mark,True,32,And if you could just dance a death clog dance all over my hopes and dreams and leave a girl turd in my happy place… Shit! I should've milked those blindies dry!
897,897,5,Mark,False,1,Sorry.
898,898,5,Mark,True,56,"Yeah, sorry. You'll be sorry, bitch. What a horrible... I couldn't hate her! Why oh why oh why didn't I tell them the phones thing?! The phones thing rocks! Sophie, climbing over my dead body to... It's not her fault, she doesn't even realise. She's just a stooge. A beautiful, stupid, ugly, shitting, filthy grasping stooge!"
899,899,5,Mark,False,1,Ha!
900,900,5,Mark,True,34,"Hey, come on Mark, keep it real. Don't let this ruin things. Besides, once you're going steady, you can grind her down, put her handbag in the fridge and tell her she's going mad."
901,901,5,Mark,False,3,Ha ha ha!
902,902,5,Mark,False,4,"Nothing, sorry. Good shot."
903,903,5,Mark,True,24,"It's just a game. A grown-up game. Mousetrap, Downfall, Hunt the Yorkshire Ripper... It's not her fault! Why didn't I mention the fucking phones?!!"
904,904,5,Mark,False,1,What?
905,905,5,Mark,False,7,I thought we were going for dinner!
906,906,5,Mark,False,4,I though we said.
907,907,5,Mark,False,5,The whole team? The team.
908,908,5,Mark,False,2,It's fine.
909,909,5,Mark,True,15,It's all fine. Everything is clear. I love her. She is going to kill me.
910,910,5,Mark,False,4,It's all totally fine.
911,911,5,Mark,False,1,Uh-huh.
912,912,5,Mark,True,53,You can never go home again. Winter's coming. Is this Stalingrad? Is this where it all ends? Or is this... where it all starts! This is a good idea. This is a great idea! It's exactly the sort of thing they're looking for and it's exactly what they're not expecting! Just do it!
913,913,5,Mark,False,11,"Alan, Mike, Barbara! Hope you don't mind if I butt in."
914,914,5,Mark,False,31,"Don't worry, I'm not going to tuck in courtesy of the expense account. I just thought this might be a good opportunity for me to share with you my vision of…"
915,915,5,Mark,False,33,"Can JLB's future wait till tomorrow? I don't think so, and I think you'll agree when you hear the great idea that I was just too darn frigging scared to spill at interview."
916,916,5,Mark,False,3,Reroute the phones!
917,917,5,Mark,True,6,This was definitely a good idea.
918,918,5,Mark,False,32,"Simple as that! Reroute the phones to everyone's mobiles. Twenty-four hour, face-to-face, round the clock customer freakin' service! It's like ""Hey I'm clocking off, finger to the customer!"" Well not anymore because…"
919,919,5,Mark,False,26,But I've worked with blind kids! I'm the full package! Think about it. I'll have my action plan on you desk first thing in the morning.
920,920,5,Mark,True,14,This was definitely a good idea. There's no chance this wasn't a good idea.
921,921,5,Mark,False,2,Hey Jeremy.
922,922,5,Mark,False,6,"Oh good, I'm feeling pretty good."
923,923,5,Mark,False,26,"The way I see it now, Barbara is an experienced man-manager and if she thinks Sophie's right for the job, then Sophie's right for the job."
924,924,5,Mark,True,69,"Hey Barbara, thought we should have a follow-up meeting re. the phones thing. Oh! You're not here! Well, I'll just leave my new idea in your desk, give you time to think about it. Yeah, so my new idea is urine. Loads and loads of urine flooding your drawers. What do you think about that? Don't you think that would be ""just the ticket""? Yeah, you're getting some too."
925,925,5,Mark,False,5,"JLB Credit, fuck off please!"
926,926,5,Mark,True,60,"What? From Sophie? Application letter to... she did it. She stiffed me. Well, Sophie's drawer's getting a dousing too, or I could park a turd on her desk. Bit freaky. Pissing's OK. Pissing's just horseplay. Oh my God! Oh no! I didn't do it! It's not my piss! It was a joke! She did it to me last week. SHIT!!"
927,927,5,Mark,False,8,Sophie? I didn't realise you were still here.
928,928,5,Mark,False,10,"Oh, just likewise. Working late. Left a file here somewhere."
929,929,5,Mark,True,8,Don't notice the piss. Don't notice the piss.
930,930,5,Mark,False,2,"Yeah, totally"
931,931,5,Mark,False,7,"Oh, let me get those for you."
932,932,5,Mark,False,9,Better not. Thanks. Got a lot to do. Thanks.
933,933,5,Mark,True,12,"Yeah, I've gotta take the letter-shaped knife out of my back, Judas!"
934,934,5,Mark,True,23,"OK, they're a bit crinkled, so what? Hello, police? Someone broke into my office and crinkled my papers and stuff. I think not."
935,935,5,Mark,False,1,Sophie?
936,936,5,Mark,False,3,It's not piss!
937,937,5,Mark,False,25,"But mainly, you're a careers guidance counsellor, right? I mean, I just want to make it absolutely clear. I'm here for careers guidance, not therapy."
938,938,5,Mark,False,6,What are you trying to say?
939,939,5,Mark,False,17,"Look, I don't want to talk about any difficult feelings I may or may not be experiencing"
940,940,5,Mark,False,3,Is it therapy?
941,941,5,Mark,True,5,He's trying to therapise me
942,942,5,Mark,True,2,Snake pit.
943,943,5,Mark,False,2,Snake... charmer.
944,944,5,Mark,True,1,Everything.
945,945,5,Mark,False,2,Not everything.
946,946,5,Mark,True,1,Blind.
947,947,5,Mark,False,2,"Er, short."
948,948,5,Mark,True,1,Fuhrer.
949,949,5,Mark,False,1,Football.
950,950,5,Mark,True,1,Sophie.
951,951,5,Mark,False,4,"Fuck! No, not ""fuck."""
952,952,5,Mark,False,16,"Can I change any of those? What score did I get? It wasn't good, was it?"
953,953,5,Mark,False,4,Right. Sure you don't.
954,954,5,Mark,True,7,"A hairy twat. A hungry, devouring twat."
955,955,5,Mark,False,2,A kitten?
956,956,5,Mark,False,24,They think I'm ill. I'm screwing the system and there's not a thing they can do about it. Sophie's gonna pay. She'll pay all right.
957,957,5,Mark,False,1,Exactly!
958,958,5,Mark,False,12,"It's political correctness gone mad. Jeremy, have you seen Strangers On A Train?"
959,959,5,Mark,False,12,It's about these two guys who take care of each other's enemies.
960,960,5,Mark,False,13,"I can't remember, but I'm pretty sure it all turns out all right."
961,961,5,Mark,False,4,This is the ultimate.
962,962,5,Mark,False,7,"Yeah, so what are you gonna say?"
963,963,5,Mark,False,35,"No! You...! Don't say that! Jesus, that's horrible! Just say something like... ask ""is Mrs Hugh Jass there"". No, no, not that. She's got a thing about her bum. How about Mike Hunt? No, no."
964,964,5,Mark,False,8,"Shit! Jeremy, she's got a fucking air gun!"
965,965,5,Mark,False,11,"Oh, God! Jesus! Mother... Bollocks, that kills, that hurts SO MUCH!"
966,966,5,Mark,True,22,"Why not come clean? You can say... you could say... nope, there is no possible way of making this look- Oh FUCK!"
967,967,5,Mark,False,10,"Yeah, I suppose everything turned out pretty much all right."
968,968,5,Mark,True,31,"I've made a psycho call to the woman I love, I've kicked a dog to death, and now I'm going to pepper-spray an acquaintance. Something... I mean, what's happened to me?"
969,969,5,Mark,False,7,"Yeah, no, it's fine. I'm on it."
970,970,5,Mark,False,25,"I give Super Hans the pizza, pepper-spray him, then kick him in the nuts and grab his wallet to make it look like a robbery."
971,971,5,Mark,True,15,What am I doing? I can't do this! There's no way I can do this!
972,972,5,Mark,False,34,"There's no pizza. It's me, Mark. I've been sent to pepper-spray Super Hans and kick him in the nuts but I can't. I can't, all right? It's all gone over the edge of reason."
973,973,5,Mark,False,13,"Look, it would really help me if you could start screaming, a bit."
974,974,5,Mark,False,9,"Yeah, and if you could tell Jeremy that I…"
975,975,5,Mark,False,8,"Jeremy, that's enough! Jez, there's no need to…"
976,976,5,Mark,False,5,It's for your own good!
977,977,5,Mark,False,7,"OK, enough careers guidance. I need therapy."
978,978,5,Mark,False,29,"Look, I don't want to talk about it any more. You didn't kick him in the nuts - that's something. You can build on that. The spray's gone Jeremy."
979,979,5,Mark,False,31,"Look, Mr Klugman has a little mantra that I'm finding very helpful. Heal and grow. Not to be patronising but perhaps you want to have a really good think about that."
980,980,5,Mark,False,1,Sophie?
981,981,5,Mark,True,6,Heal and grow. Heal and grow.
982,982,5,Mark,False,6,Good to see you. Come in.
983,983,5,Mark,False,8,I've been feeling a little low lately but…
984,984,5,Mark,False,11,"Oh, that. That's nothing. Jeremy just hit me, with the ladle."
985,985,5,Mark,False,9,"Sophie, Sophie, Sophie, relax. I'm fine. Life is fine."
986,986,5,Mark,True,6,"Cool, wet grass. Cool, wet grass."
987,987,5,Mark,False,21,I'm having therapy. I'm going to the solarium. I have spoken with the Citizens Advice Bureau. There's nothing inside killing me.
988,988,5,Mark,True,4,Lying bitch! NOT bitch.
989,989,5,Mark,False,11,"It's fine, fine, fine. I've let go of all that stuff."
990,990,5,Mark,False,1,Totally.
991,991,5,Mark,False,2,Ahh. Right.
992,992,5,Mark,True,13,"Jesus, so she didn't... Oh God! I'm such a cockmuncher! No, NOT cockmuncher."
993,993,5,Mark,False,2,Your team?
994,994,5,Mark,True,6,Heal and grow! Heal and grow!
995,995,5,Mark,False,37,"Well, I guess it's very nice for the big lady to come down here and talk to the little man. I'm just surprised you can see me from all the way up there in your ivory tower."
996,996,5,Mark,False,7,"Sophie! Sophie! Sophie! Don't go! Sophie, I..."
997,997,6,Mark,False,27,"Plus it was so cold and wet and boring in the outfield. I mean personally, I don't think I've ever seen a ball that slippery, have you?"
998,998,6,Mark,True,16,"This is it. All systems are go. The apple is ripe, the cross hairs are centralised."
999,999,6,Mark,False,9,"Soph, I was wondering, do you like Indonesian food?"
1000,1000,6,Mark,True,28,It's too much. I'm not American. I can't date. Restaurant on a barge? I might as well ask her to marry me. The pub. That's the English way.
1001,1001,6,Mark,False,13,"Oh just... nothing. But listen, everyone's going to the pub. You want to...?"
1002,1002,6,Mark,True,6,"Oh, no, no, not at all."
1003,1003,6,Mark,False,33,"Oh, my God. She's taking off her top. This is very promising. Or is it? Would she do this if she fancied me? Maybe we're... oh, God, no, no, we're only bloody friends!"
1004,1004,6,Mark,False,14,And then she gave me a peck on the cheek. It's a living nightmare!
1005,1005,6,Mark,False,27,"I've got to close the deal, I've gotta ask her out without actually asking her out. One step forward, two steps back, that's the key to progress."
1006,1006,6,Mark,False,5,So how was your day?
1007,1007,6,Mark,False,4,Yeah? Is it serious?
1008,1008,6,Mark,False,11,"Hospice? You... Jez, you know what a hospice is, don't you?"
1009,1009,6,Mark,False,11,A hospice is where people go to... who are terminally ill.
1010,1010,6,Mark,False,10,"Well, I have to say, probably not mate. Probably not."
1011,1011,6,Mark,False,8,Have you thought about giving him a call?
1012,1012,6,Mark,False,10,"I don't know, I think maybe you should call him."
1013,1013,6,Mark,False,10,"So, Ray, Jez tells me you worked on the force."
1014,1014,6,Mark,False,23,"Blimey. So must be nice, getting a bit of support from your police mates. The force. You can trust the force, can't you?"
1015,1015,6,Mark,False,20,"People can be so funny when it comes to illness, can't they? I mean, it's good that you... you know…"
1016,1016,6,Mark,False,10,"Yeah, that's really a great thing to have, a faith."
1017,1017,6,Mark,False,3,Has it...? is...?
1018,1018,6,Mark,False,4,"Oh, man, I'm sorry."
1019,1019,6,Mark,False,4,Shall I turn over?
1020,1020,6,Mark,False,4,That's a nice idea.
1021,1021,6,Mark,True,36,"It's perfect. Big social occasion but no invites. It's not a date, but it is. What if it all goes right, though? What do I do about my massive, freakish balls? Don't get ahead of yourself."
1022,1022,6,Mark,False,2,"Hey, Soph."
1023,1023,6,Mark,False,16,"Well, actually, things have been a bit tough to be honest. Jeremy's uncle passed away yesterday."
1024,1024,6,Mark,False,22,"Yeah, bearing up, you know. But listen, Sophie, I wanted to ask you, might you be free on Friday? For the funeral?"
1025,1025,6,Mark,True,11,"Oh. Oh no, shit. It's not perfect, it's cracked. Oh piss."
1026,1026,6,Mark,False,14,"I mean, you don't have to. I just thought it might be nice if…"
1027,1027,6,Mark,False,22,"No, no, not friend. No. As a kind of date. I mean I thought afterwards, if you like, we could go somewhere."
1028,1028,6,Mark,False,4,Somewhere like the wake.
1029,1029,6,Mark,False,8,"That's the beauty, no invites at a funeral."
1030,1030,6,Mark,False,23,"Jesus, where did they get this guy? This whole thing is a freak show. Why am I even here? Why is she here?"
1031,1031,6,Mark,True,6,"Hey, yeah, OK. The sympathy vote."
1032,1032,6,Mark,True,22,"Well done, Jez, old mate, you did him proud. Oh, poor Ray. He's in there, in that cardboard box. I can't believe…"
1033,1033,6,Mark,True,7,Shit! This just gets better and better!
1034,1034,6,Mark,False,13,"No, I'm OK, I'll be fine. I've got to be strong for Jeremy."
1035,1035,6,Mark,False,9,"Right. One minute we're alive, the next we're dead."
1036,1036,6,Mark,False,16,"Right, yeah. I mean, if I want an X-Box, why don't I just get an X-Box?"
1037,1037,6,Mark,True,3,You're losing her.
1038,1038,6,Mark,False,8,It's a brief candle. A bloody brief candle.
1039,1039,6,Mark,False,8,"Sophie, c-can I say how beautiful you look?"
1040,1040,6,Mark,False,43,"Can- can I kiss you, Sophie? Oh, my God. Umm what about my abnormal knackers? Ooh, this is nice. How weird are they? What I really need is a good, long look at another man's bollocks. But that's so fraught with potential problems."
1041,1041,6,Mark,False,4,Oh. That was nice.
1042,1042,6,Mark,True,9,Thank you Ray! Thank you Ray! Thank you Ray!
1043,1043,6,Mark,False,5,"Hey, Jez! I've got news!"
1044,1044,6,Mark,False,28,"Sophie's coming away with me to a cottage with a bed for the weekend! Now, listen mate, I need to ask you a straight-up, man-to-man question about bollocks."
1045,1045,6,Mark,False,3,What? Y-you're kidding.
1046,1046,6,Mark,False,8,"Tests? Jesus, mate. Fuck. No, are you OK?"
1047,1047,6,Mark,False,4,"Look, don't be scared."
1048,1048,6,Mark,False,3,Don't be scared.
1049,1049,6,Mark,False,10,"That's fine, that's fine. It's perfectly natural to be scared."
1050,1050,6,Mark,True,21,"Doctor Runcimen has seen this a thousand times. It's just two guys, one with his hand on the other guy's balls."
1051,1051,6,Mark,False,5,Oh. Pleased to meet you.
1052,1052,6,Mark,True,6,"No. No, no, no, no, no."
1053,1053,6,Mark,False,22,"Oh, it was just- I think I should probably see the doctor. You know, not that I've got anything against... your kind."
1054,1054,6,Mark,False,16,"Basically, it's, uh, not wishing to beat about the bush, it's a problem with... with my..."
1055,1055,6,Mark,False,7,"Test-ist-icles. So if you'd feel happier, I…"
1056,1056,6,Mark,True,46,"Oh, I hope I don't- no leaping to attention, Captain Corrigan. I mean anyone would say she's an attractive woman. She should have to wear a mask for this kind of thing. Reagan or Batman or... actually, she'd look pretty horny as Batman. Jesus, no, don't!"
1057,1057,6,Mark,False,6,So have you... worked here long?
1058,1058,6,Mark,False,3,Blimey? What's blimey?
1059,1059,6,Mark,False,12,"No, no, no, that feels great. I mean, not great, just normal."
1060,1060,6,Mark,True,7,"Ooh, how much can a man take?"
1061,1061,6,Mark,True,13,"Yep, that's cooled things off, that's a regular bucket of water right there."
1062,1062,6,Mark,False,8,"OK, Jez, mate. I think that's about it."
1063,1063,6,Mark,False,14,I don't know. He gets the test results on Monday. What do you think?
1064,1064,6,Mark,False,12,"The thing is, he's not definitely dying. He's not even definitely ill."
1065,1065,6,Mark,False,27,"I think that's just Biro. Anyway, he seems to be over that now. And the whinnying. Things are looking positive. He's investigating the key to all spiritualities."
1066,1066,6,Mark,False,34,"Uh Jez. Me and Soph, we were just having a chat, and, well, what we were saying is that actually what we both really want is for you to come along on our weekend."
1067,1067,6,Mark,False,11,"Oh, come on, you can take your religious texts with you."
1068,1068,6,Mark,True,7,Maybe he really doesn't want to come!
1069,1069,6,Mark,False,6,It'll just be such a laugh.
1070,1070,6,Mark,True,6,"Please say no, please say no."
1071,1071,6,Mark,True,35,"If I can just get the first one over without a major embarrassment. First fuck is damage limitation. In, out, as much pleasure as I can give her, apologise, and then we can move on."
1072,1072,6,Mark,True,7,"Jesus, look at him. What a disaster."
1073,1073,6,Mark,False,10,Do you have to? We're trying to play a game.
1074,1074,6,Mark,False,13,"Well, if you don't want your go, I'll take mine, I'm attacking Irkutsk."
1075,1075,6,Mark,False,8,Yeah well you will when I take Asia.
1076,1076,6,Mark,False,17,"Well, fine. I'm off for a shower. Good night, Jeremy. See you in the bed... room, Soph."
