,index,Episode,Speaker,Internal,NumWords,Lines
531,531,1,Mark,False,32,"See, by the winter of '42, the whole city was surrounded by the massed 6th army. It was pressing and pressing. The Russians couldn't hold on much longer. Many wanted to submit..."
532,532,1,Mark,False,29,"No, no, of course not, what I mean is that the German supply lines were stretched, Zhukov countered and the siege was broken. And that's the story of Stalingrad."
533,533,1,Mark,True,16,"That was embarrassing. Not a fuck jar. Don't dwell, no need to dwell. Think charming, considerate."
534,534,1,Mark,False,7,"So your sister, she looks great considering..."
535,535,1,Mark,False,9,"No, no, you know, the whole thing. The leukaemia."
536,536,1,Mark,True,10,The second front. I can win on the second front.
537,537,1,Mark,True,49,"This is so perfect. I'm gonna be the knight on horseback with an armful of booze and enough nachos to feed the Mexican army. Oh shit. Shit. Fuck off! Why don't you fuck the fuck off? Just run the gauntlet, the little bastards will... It's gonna shut as well."
538,538,1,Mark,False,28,"Uh, excuse me, mate? Sorry to bother you, this is a bit embarrassing really but you couldn't possibly buy me a couple bottles of wine, Pinot Grigio maybe?"
539,539,1,Mark,True,8,I bet Zhukov would've got some booze. Oh!
540,540,1,Mark,True,1,Bastard.
541,541,1,Mark,False,8,"What? Oh Jeremy, I'm so sorry. I thought..."
542,542,1,Mark,False,7,I accidentally told him Paula had cancer.
543,543,1,Mark,False,21,"Hey! Listen mate, I made a mistake. It was you who wouldn't give the name of the doctor for Toni's sister."
544,544,1,Mark,False,12,"Yeah, well really really nice to catch up, Soph. See you tomorrow?"
545,545,1,Mark,False,1,Great
546,546,1,Mark,True,42,"Yes, that's the way. Sophie's the one. Toni's Russia - vast, mysterious, unconquerable. Sophie's Poland - manageable, won't put up too much of a fight. Shit. Oh shit. OK. You want some, do you? Do you want a taste of my steel?"
547,547,2,Mark,True,41,"I wonder what kind of socks Sophie wears. Do women wear socks? Well, yes, sometimes is the answer to that. Socks before or after trousers, but never socks before pants, that's the rule. Makes a man look scary, like a chicken."
548,548,2,Mark,True,8,He just does not give one solitary shit.
549,549,2,Mark,True,25,"Brown for first course, white for pudding. Brown is savoury, white's the treat. 'Course I'm the one who's laughing because I actually love brown toast."
550,550,2,Mark,False,2,Dr. J!
551,551,2,Mark,False,14,Sorry I didn't manage to hook up with you and Super Hans last night...
552,552,2,Mark,False,11,"then Barbara pops up with ""Is the Birbeck file ready yet?"""
553,553,2,Mark,False,28,"I didn't get a chance to tell you the good news. Yeah, there's a vacancy going for a clerical assistant and I've managed to swing you an interview."
554,554,2,Mark,False,7,So is tomorrow at eleven all right?
555,555,2,Mark,False,20,"It's a damn good company and it'll be the two of us together, Jez and Mez, the El Dude Brothers."
556,556,2,Mark,False,10,"You know how much I respect your music, it's just…"
557,557,2,Mark,False,15,"I'm on your side. Every artist needs his patron but, you know, there's a limit."
558,558,2,Mark,False,15,"I'm not some kind of land baron trying to milk his cash cow, it's just…"
559,559,2,Mark,False,1,Sorry?
560,560,2,Mark,False,1,Right?
561,561,2,Mark,False,23,"But listen Jeremy, just in case the song doesn't work out, maybe you'd better fill this out and fax it over by three."
562,562,2,Mark,False,12,"Think about it. And have a great day, yeah? See you tonight."
563,563,2,Mark,False,3,"You, too, mate."
564,564,2,Mark,True,2,Work-shy freeloader.
565,565,2,Mark,True,17,I wonder what Sophie's flirty cartoon will be today. I really should ask her out for lunch.
566,566,2,Mark,False,4,Can you hold that?
567,567,2,Mark,True,2,You bastard.
568,568,2,Mark,False,3,Thanks. Third floor?
569,569,2,Mark,True,25,"I mean, what's the worst that could happen? She could say no. Actually, that would be terrible. It would destroy me if she said no."
570,570,2,Mark,False,25,"There is a notice, you know, about only riding the lift to the first floor. You're wasting mine and other people's time, not to mention…"
571,571,2,Mark,False,3,"Oh. Uh, OK."
572,572,2,Mark,True,17,"People like him should wear stickers. They've got them for their cars. Oh, yeah. Great idea, Adolf."
573,573,2,Mark,False,2,"Hey, Sophie."
574,574,2,Mark,True,4,"Go on, ask her."
575,575,2,Mark,False,18,"Sophie, are you... I mean, would... how's your day going thus far? Have a nice shower or bath?"
576,576,2,Mark,False,15,"God, no, you don't smell. I mean, you smell nice. Not that I've smelt you."
577,577,2,Mark,False,2,"Later, potater."
578,578,2,Mark,True,6,"Uh, potater. What have I become?"
579,579,2,Mark,True,17,"OK, where's today's cartoon? Mmm, not bad. No discernible romantic overtones. OK pen, let's flirt with Sophie."
580,580,2,Mark,True,22,"What the hell is that? That is very gay, that's what that is. Come on, go crazy! You're hungry like the wolf!"
581,581,2,Mark,True,35,"(I'm giving her a love heart. Yes, that's good. No, no, it's not good. It's terrible. Think ""crazy horse"", think ""in your face"". What would Jeremy do? Heh heh, yeah, that's it, love's for Nazis.)"
582,582,2,Mark,True,8,"Yeah, crazy love. Nazi love. I'm a nutter!"
583,583,2,Mark,True,20,And then I go and seal the deal by doing something wicked like this car-toon. Swastika love. It's bloody mental.
584,584,2,Mark,True,31,"A bloody swastika. That is the single worst single bloody idea ever. I mean, a swastika! It's gone. It's happened. Oh, yeah, do what Jeremy would do. Thanks, Jeremy, you tit."
585,585,2,Mark,True,7,"Enter the pit of Sarlacc, little crisps."
586,586,2,Mark,True,65,"She's ignoring me. Of course, she's ignoring me, this morning I sent her a bloody swastika. Jesus! This is the worst thing that has ever happened to anyone ever and... relax, Mark. You're not Hitler in his bunker. He was really under the cosh. Mind you, at least he had a girlfriend. OK, enough mooning, let's strap on the nosebag and eat some serious work."
587,587,2,Mark,True,15,"Blown it with Sophie. Who's next? Big Suze? Never met her, not necessarily a disadvantage."
588,588,2,Mark,True,27,"Why don't I get this fixed, why don't I ever get this fucking thing fixed?! Every night it's fift- ah, it always comes out eventually, fuck it."
589,589,2,Mark,False,5,"Oh, I'm so, you did?"
590,590,2,Mark,False,2,Race hate?
591,591,2,Mark,False,32,"Right, exactly. Listen, Sophie, I was wondering if I could get your home number. I mean, for work, in case I need to swap a shift or... that is, if you don't…"
592,592,2,Mark,True,4,She's actually writing it.
593,593,2,Mark,False,13,"Oh, hang on, this isn't enough numbers. Oh, no, it is enough numbers."
594,594,2,Mark,True,10,"Oh, God, I hope she doesn't mind about my balls."
595,595,2,Mark,False,18,"Exactly. If it's such a bad thing to do things by the book, there wouldn't be a book."
596,596,2,Mark,True,22,"Have to keep an eye on him if he gets it. If there's one thing JLB does not need, it's a maverick."
597,597,2,Mark,False,7,"So anyway, things went rather well with…"
598,598,2,Mark,False,6,"Oh, what? Just because he's black?"
599,599,2,Mark,False,13,"I know what you meant. Anyway, in the end, I got Sophie's number."
600,600,2,Mark,False,23,"So do you think I should give her a call? I probably should, shouldn't I. Oh I really don't know if I should."
601,601,2,Mark,False,20,"OK listen, if God's doing mountains or sky or water, I'll call. If he's doing trees or critters, I won't."
602,602,2,Mark,False,5,"Yeah, sky! Right, here goes."
603,603,2,Mark,False,1,Answerphone.
604,604,2,Mark,False,101,"Uh, Sophie. If you heard that, please ignore it, I'm not a racist. Far from it. Anyway uh it's good to hear your voice. I know it's only a recording but you have got a bloody nice voice and... God, I just called up to say hi and then, then I go and spoil it all by saying something stupid like I like you. I mean, not that. But anyway I noticed that the paper in the photocopier is running a bit low so I know it's not really your job but uh well you know, so, uh see you tomorrow."
605,605,2,Mark,False,4,"Fuck, fuck, fuck, fuck!"
606,606,2,Mark,False,3,"Oh, my God."
607,607,2,Mark,False,10,I've really fucked it haven't I? Have I fucked it?
608,608,2,Mark,False,7,It was the behaviour of an oddball.
609,609,2,Mark,False,1,No.
610,610,2,Mark,False,2,I'm sorry?
611,611,2,Mark,False,1,What?
612,612,2,Mark,False,6,Why are you talking like this?
613,613,2,Mark,False,4,You're doing pyramid selling?
614,614,2,Mark,False,7,I can't believe you're into pyramid selling.
615,615,2,Mark,False,14,"Oh, the charts. There are charts. Why didn't you tell me about the charts?"
616,616,2,Mark,False,10,I'm trying to protect you from pissing all over yourself.
617,617,2,Mark,False,6,You're still coming to the interview.
618,618,2,Mark,False,58,"Listen, Jeremy, you don't seem to understand. Nothing you want is ever gonna happen. That's the real world. Your hair isn't red, people don't walk around on stilts. Maybe somewhere, you can earn a living sitting around drinking margaritas through a curly plastic straw, but in this world, you've got to turn up, log on and grind out."
619,619,2,Mark,False,14,"Come Friday, you will owe me three months' rent. You're coming to the interview."
620,620,2,Mark,False,1,What?
621,621,2,Mark,True,67,"Maybe she will think it was charming. Yeah, maybe. Just keep clear of her until you've worked out a, I could say Jeremy had a gun and made me sing it, because he's a crackhead and he does that sort of thing all the time. Yeah yeah, that sounds great, me living in my crack house, maybe you can be a crack bitch, and sit on my..."
622,622,2,Mark,True,8,"Shit! Shit, sugar, fudge, piss, poop, pants, bollocks."
623,623,2,Mark,True,27,"Yes, blitzkrieg! I'm in the Ardennes! You can't touch me in the Ardennes. Concealed in the cupboard. Everything's OK in the cupboard. I'm safe in the cupboard."
624,624,2,Mark,False,3,"That's right, Jeff."
625,625,2,Mark,False,2,"Yeah, well..."
626,626,2,Mark,False,16,"Hi Sophie. I'm just in the cupboard right now. About the message, we'll talk later, yeah?"
627,627,2,Mark,True,1,Nooooo!
628,628,2,Mark,True,4,He looks like crap.
629,629,2,Mark,True,48,"Great, he'll be able to pay off the Blockbusters fine, plus I'll be able to order him around. Not horrible, just ""Jeremy, could you file this for me? Jeremy, could you take that for me? Jeremy, could you suck this for me?"" Jesus! Where did that come from?"
630,630,2,Mark,False,4,Challenging. He means challenging.
631,631,2,Mark,False,2,"Yes, right."
632,632,2,Mark,False,1,What?
633,633,2,Mark,False,2,What thing?
634,634,2,Mark,False,6,Facial spa... you do not have…
635,635,2,Mark,False,2,"No, Jeremy."
636,636,2,Mark,False,8,"It's pyramid selling Barbara, I'm very sorry and…"
637,637,2,Mark,False,11,It is pyramid selling and you're making a fool of yourself.
638,638,2,Mark,False,4,There is no bonfire!
639,639,2,Mark,False,7,This is low. This is really low.
640,640,2,Mark,False,15,What does that mean? I literally have no idea what that is supposed to mean!
641,641,2,Mark,True,41,"Well, that was a fucking disaster. I want compensation. I want reparations, brutal reparations! I want the Rhineland. It's going to be 1919 all over again. Fuck the inevitable backlash! OK. It's OK, Mark. Later. Now, calm. Calm, honest and mature."
642,642,2,Mark,False,2,"Hi, Sophie."
643,643,2,Mark,False,2,Oh yeah?
644,644,2,Mark,False,7,"Huh. Yeah, I know what you mean."
645,645,2,Mark,True,7,"Get your tanks off my lawn, Jeremy."
646,646,2,Mark,False,47,"But uh listen, Sophie, about the message last night. I want to kind of come clean really. It's a bit embarrassing but, well, the thing is Jeremy, sometimes, for a laugh, makes me say things with a bread knife. I mean he's obviously not a crackhead but…"
647,647,2,Mark,False,1,Yeah.
648,648,2,Mark,False,2,I don't?
649,649,2,Mark,False,14,"Is it? It is? Oh, right. Fantastic. And you haven't told anyone about it?"
650,650,2,Mark,False,9,"Oh, thank you, thank you, thank you, thank you."
651,651,2,Mark,True,7,"Calm down, she's not bloody Pontius Pilate."
652,652,2,Mark,False,59,"Yeah, well, you know the truth is... the truth is, I suppose I like you. That's why I said the song. I like you. Is that such a crime? Should I be hounded to the ends of the Earth just for liking you? I like you and if you can't handle it, you can just, you know, fuck off."
653,653,2,Mark,False,5,"Good. Right, excellent. OK. Bye."
654,654,2,Mark,False,19,"Er, yeah right, I'm really sorry. I mean, I thought it would be a good, that he might, but…"
655,655,2,Mark,False,36,"Hey! Hey, there! Feeling better now, are we? Fully recovered? Hey, I see you! I see you! He used to have a limp! I mean, he pretended to have a limp. He's a faking little peg-leg!"
656,656,2,Mark,False,2,"Hi, Jeff."
657,657,2,Mark,True,19,"Well, fuck you if you're not doing small talk, I'm not going to help us out. Let's die together."
658,658,3,Mark,True,46,"Life's all pain. Pain, rejection and gloom. Why do we even pretend there's anything other than a yawning blankness at the heart of, Hey! 33% extra free. I am doing excellent shopping. My depressed state of mind means I am being even more frugal than normal."
659,659,3,Mark,False,2,Hey Jeremy.
660,660,3,Mark,False,11,"Oh no, mate. This stuff is 78 pence a hundred millilitres."
661,661,3,Mark,False,27,"Look Jeremy, we've been through this before. I do the joint shopping solo because I don't make impulse purchases and I'm less swayed by the power of…"
662,662,3,Mark,False,18,Do I look like the kind of man who goes to wicked parties? Why don't you ask Toni?
663,663,3,Mark,False,10,"Don't be ridiculous, they're homey. They're for wiping up mess."
664,664,3,Mark,False,9,"Well they're for men! Men's noses, big manly snot."
665,665,3,Mark,False,22,What? Why do you have to have a huge can of lager that makes you really really drunk? What's wrong with moderation?
666,666,3,Mark,False,9,That's not going to be happening any time soon.
667,667,3,Mark,False,1,Mm-hm.
668,668,3,Mark,False,23,I mean it's not a date or anything because I've got a megapass. How do you feel about row G by the way?
669,669,3,Mark,False,3,"Yeah, I thought-"
670,670,3,Mark,False,17,"No, thank you. How much pain can I experience at home with a spaghetti carbonara and Das Boot."
671,671,3,Mark,False,10,"That's right. No queues, so who exactly is winning then?"
672,672,3,Mark,True,70,"OK, well, I'm here, so I'll just sit here and drink. No one can stop me doing that. Just drink myself to death. I bet he gets sex tonight and I have to listen to it through the wall. Maybe she might go to the bathroom and accidentally come into my room. And then what? She fucks you? No, she says ""whoops"" and goes out. Stop doing this to yourself."
673,673,3,Mark,True,67,"Someone here's got psoriasis, one of the less common skin ailments. Basic yeast infection, rash if you're thinking glamorous, athlete's foot if you're not. A fellow migraine sufferer? Everyone at this party isn't as young, fit and single as they're making out. Yes let's face it, we're all falling apart piece by piece. Doesn't matter if you're single or in a couple. You. Are. Going. To. Die."
674,674,3,Mark,False,8,Frozen stuff. I don't want them to thaw.
675,675,3,Mark,False,1,Yeah!
676,676,3,Mark,False,6,That would be the natural reaction.
677,677,3,Mark,False,2,"Yeah, sure."
678,678,3,Mark,False,17,"Oh I'm not in the game. If I can get my shopping home intact, I'll be happy."
679,679,3,Mark,False,10,"That, to me, is a very attractive system you're proposing."
680,680,3,Mark,False,27,"Yeah, well you know, everything's decaying, so the way I see it. Has there ever been a better time to save up for a very comfortable sofa?"
681,681,3,Mark,True,18,"She's a teenager for God's sake, Mark. You'll get castrated by the menfolk. Maybe she's a- Oh, God."
682,682,3,Mark,False,15,Oh that's a bit much. Just pretend you need his bone marrow. Apparently that's agony.
683,683,3,Mark,False,13,"Hey Jez, I just wanted to tell you we're going... to the Lazerbowl."
684,684,3,Mark,False,25,"Yeah, me and Valerie. We were going to kill her brother but then we thought it might be more fun to go to the Lazerbowl."
685,685,3,Mark,False,28,"I hadn't thought you would be... maybe I'll see you later at home, yeah? Would you mind taking the shopping? I've left some stuff in the freezer compartment."
686,686,3,Mark,False,5,Er... I mean... I guess…
687,687,3,Mark,False,3,You think so?
688,688,3,Mark,True,44,"I've got to take Jeremy's advice more often. I'm out on a date with a teenage goth, smoking pot in the Lazerbowl toilets. This is it. This is literally it. This is the sort of thing people do when they're having a good time."
689,689,3,Mark,False,4,I don't know if…
690,690,3,Mark,False,3,What? In here?
691,691,3,Mark,True,9,"Oh my God, it's the last days of Rome."
692,692,3,Mark,False,1,Wow!
693,693,3,Mark,True,11,I've been initiated. I am a drug user. Fuck the police!
694,694,3,Mark,False,8,"Jez, the faces, the faces. I feel strange."
695,695,3,Mark,False,8,Don't poke my eyes! Don't poke my eyes!
696,696,3,Mark,False,19,"I don't think so. What if I lose it? I'm not going to do a poo, am I Jez?"
697,697,3,Mark,True,28,Jez is so great. He's like an idiot savant but not so stupid. I bet he's totally sorting this whole night in his head for us right now.
698,698,3,Mark,False,4,"Uh-huh, yeah. Me too."
699,699,3,Mark,False,6,"Yeah, right, obviously, no... me too."
700,700,3,Mark,False,6,I guess she just really likes Sledgehammer.
701,701,3,Mark,False,1,Yeah.
702,702,3,Mark,True,3,Forgive me Peter.
703,703,3,Mark,False,5,I mean it's so... outdated.
704,704,3,Mark,False,13,"Right, I mean what's her problem? I've never heard of Level 42 either."
705,705,3,Mark,True,4,"Guys, I'm so sorry."
706,706,3,Mark,False,2,You are?
707,707,3,Mark,False,8,Right. I just didn't want to disturb them.
708,708,3,Mark,True,9,Oh my God. Oh my God. Oh my God.
709,709,3,Mark,False,5,Hi... Sophie. This is Valerie.
710,710,3,Mark,False,3,How's it going?
711,711,3,Mark,False,30,"Yeah, yeah, fine. I- Valerie and I- I mean we just met and we thought we might come here for a few bowls, and I'm high, obviously. How about you?"
712,712,3,Mark,False,1,Jeff?!
713,713,3,Mark,False,3,Yeah it's great.
714,714,3,Mark,False,6,"Yeah, Jeff did do that, actually."
715,715,3,Mark,False,12,No that's true. You were something of a trendsetter in that area.
716,716,3,Mark,False,4,"She's at college, actually."
717,717,3,Mark,False,4,Yeah that's still college.
718,718,3,Mark,True,13,"For the worst thing that could possibly happen, this is going extremely well."
719,719,3,Mark,True,17,"I'm bursting! This is why you should stick to the little cans, ah, the simple pleasures. Oh…"
720,720,3,Mark,False,3,"Uh, yeah, yeah."
721,721,3,Mark,False,9,"Well you know, it's just a bit of fun."
722,722,3,Mark,True,16,"Oh God, go. I'm never going to be able to go now. Why can't I go?"
723,723,3,Mark,True,3,"Fuck! Italian, wine."
724,724,3,Mark,True,5,Why didn't I ask her?
725,725,3,Mark,True,9,"It's all- Shit! Waterfalls, nothing! Pretend you've finished. Ahh!"
726,726,3,Mark,False,2,What? You-
727,727,3,Mark,True,11,"She hates fruit, except pears. If there's pear flavour, I'm fucked."
728,728,3,Mark,False,8,So this is nice. Kind of weird but...
729,729,3,Mark,False,14,"Great, so I was just wondering how you ended up coming out with Jeff."
730,730,3,Mark,False,10,He asked you? Of course. Is that all it takes?
731,731,3,Mark,False,8,I mean I did actually ask you myself.
732,732,3,Mark,False,4,"Oh, Valerie, she's nothing."
733,733,3,Mark,True,4,That didn't sound good.
734,734,3,Mark,False,29,"I mean... It's just... A little nice out. I'm a friend of her brother's. He's a total wanker, actually. So, have you had a good time on your... date?"
735,735,3,Mark,True,4,Ha! Idiot! I win!
736,736,3,Mark,False,16,"Cool. So, old seat sniffer, he didn't sniff any of the seats or anything, didn't he?"
737,737,3,Mark,False,5,A nice guy? You should've…
738,738,3,Mark,False,5,You're having a good time.
739,739,3,Mark,False,9,"Good, because obviously, I'm having a great time too."
740,740,3,Mark,True,10,She's not going to do it. They won't do it.
741,741,3,Mark,True,14,Don't let him know he's got to you. Play it cool. Play it suave.
742,742,3,Mark,False,22,"I think I can manage that, mate. Watch me bowl, Jeff! I'm bowling all right, I'm bowling fruit! I'm on another level! I've gone beyond!"
743,743,3,Mark,False,10,"I'm sorry, I'm really sorry. I thought they would just…"
744,744,3,Mark,False,7,What do you know about my shoes?
745,745,3,Mark,False,14,"Don't go! Soph, you should stay and bowl! Bowl the night away with us!"
746,746,3,Mark,False,16,"Once they get the stuff out, we can have a little tournament and it'll be fun!"
747,747,3,Mark,True,13,"Don't think about it. If you don't think about it, it won't happen."
748,748,3,Mark,True,52,"Straight to Frenching. So easy. I bet Sophie and Jeff are doing a lot of talking right now. Yeah, she can really talk, probably boring him rigid about the Celestine Prophecy. Maybe Jeff's bought loads of booze, Sophie could be pissed - too pissed to mind. Ow! She's squeezing my- don't complain!"
749,749,3,Mark,True,65,"She hasn't said anything about my nuts. She's probably too young to know how weird they are. I'm having sex with a teenage girl! Sophie wouldn't... not with the seat-sniffer. I mean we've got a connection. This is not wrong. Just try and memorise it for later. Mm, this could be nice. A nice, lovely neck rub. She's strangling me! She's trying to kill me!"
750,750,3,Mark,False,15,"I can't! I can't! Jesus Valerie, w-what! Why didn't you say if you didn't like it?"
751,751,3,Mark,False,11,"Thanks, thank you. It was just the... not breathing. You know."
752,752,3,Mark,False,24,"No problem, I'll be fine on the sofa. Have you got everything you need? Do you want me to leave the hall light on?"
753,753,3,Mark,False,5,"No, right, sure, of course."
754,754,3,Mark,True,16,"God, she does look kind of great in my pyjamas. That's sick. Why is that sick?"
755,755,3,Mark,False,6,"Valerie, I was thinking, the sofa…"
756,756,3,Mark,False,6,"So I was thinking, the sofa."
757,757,4,Mark,True,10,Don't screw this up. No screw ups. Got to impress.
758,758,4,Mark,False,3,"Uh, well, no."
759,759,4,Mark,True,6,"Oh, yes. Yeah, I like it."
760,760,4,Mark,True,7,Brilliant. That is just so spot on.
761,761,4,Mark,False,4,"Right. Absolutely, dead right!"
762,762,4,Mark,True,11,"Alan Johnson, I'm in love. I'm in love with you, Johnson."
763,763,4,Mark,False,5,"Hi, come in, come in."
764,764,4,Mark,False,2,"Good, thanks."
765,765,4,Mark,True,13,Ask her to go the bar. Ask her to go to the bar!
766,766,4,Mark,False,1,Yeah
767,767,4,Mark,False,1,Yeah?
768,768,4,Mark,False,2,"Right, well..."
769,769,4,Mark,False,5,I mean I could... help.
770,770,4,Mark,False,4,Oh yeah. Totally. Absolutely.
771,771,4,Mark,True,7,Dave's the saint. Nothing must unseat Dave.
772,772,4,Mark,False,4,"Soph. Honestly, it's fine."
773,773,4,Mark,False,2,"OK, night."
774,774,4,Mark,True,27,"Go on, yes, I now what you're thinking. I'm shit, you're great, I'm the worm, you're the king. Yeah, well eat your nuts and go fuck yourself."
775,775,4,Mark,True,69,"I only asked about the bus. No need to make out I'm some kind of freak. Checking in to the hotel it's all ""Can we get you fresh whatever"" and once you're on the way out it's ""one of you is liable for the cashews."" Sophie. Jeff? That fucking... What's the story there? This is the worst thing to happen to anyone ever. Oh my fucking life. It's Alan Johnson."
776,776,4,Mark,False,6,"Yes, yes it is. It's Mark."
777,777,4,Mark,False,6,Oh I would love a lift.
778,778,4,Mark,True,11,Shit! This is the best thing that's happened to anyone ever.
779,779,4,Mark,True,34,"Look at me. Friends with a big, black businessman like it's the most natural thing in the world. If he got accused of a crime he hadn't committed, I could come to his aid."
780,780,4,Mark,False,1,Jez?
781,781,4,Mark,False,2,"Er, yes."
782,782,4,Mark,False,2,Ehhh! Ehhh!
783,783,4,Mark,False,5,"Jez, are you all right?"
784,784,4,Mark,False,22,"Right. That's very nice and everything, Jez. I should open some wine. I've actually got rather a good friend coming over later."
785,785,4,Mark,False,7,I totally agree. I couldn't agree more.
786,786,4,Mark,False,2,It's pathetic.
787,787,4,Mark,True,7,Oh God! Not in front of Johnson.
788,788,4,Mark,False,15,"So if you like, I'll show you what I've done so far on the book."
789,789,4,Mark,False,16,Business Secrets of the Pharaohs? It's only the opening chapter but it gives a flavour of...
790,790,4,Mark,False,4,It doesn't seem to...
791,791,4,Mark,False,6,"No, but it wasn't working when…"
792,792,4,Mark,True,16,"Me and Johnson, Johnson and me. We only met a fortnight ago. Everything's happening so fast!"
793,793,4,Mark,False,11,That sounds... I don't know what to say. That sounds amazing.
794,794,4,Mark,False,15,"Yeah, but the relocation thing. Moving out on Jeremy. It feels a bit weird, Dad."
795,795,4,Mark,True,1,Shit!
796,796,4,Mark,False,4,It feels weird... Daddy-O.
797,797,4,Mark,True,2,Good save
798,798,4,Mark,False,14,"Well, nowadays, email and so forth. Do I really need to move to Cardiff?"
799,799,4,Mark,False,2,Uh-huh. Interesting.
800,800,4,Mark,True,23,"I've got tell him. How am I going to tell him? Oh, this is horrible. He might crumble, he's weak. Remember the Johnson."
801,801,4,Mark,False,2,Hey Jez!
802,802,4,Mark,False,18,"So, what do you make of this place? You just choose whatever you want from the revolving belt."
